"title","year","venue","authors","type","url","abstract"
"ConMe: Rethinking Evaluation of Compositional Reasoning for Modern VLMs.","2024","CoRR","Irene Huang, Wei Lin 0019, M. Jehanzeb Mirza, Jacob A. Hansen, Sivan Doveh, Victor Ion Butoi, Roei Herzig, Assaf Arbelle, Hilde Kuehne, Trevor Darrell, Chuang Gan, Aude Oliva, Rogério Feris, Leonid Karlinsky","Informal and Other Publications","https://dblp.org/rec/journals/corr/abs-2406-08164","Compositional Reasoning (CR) entails grasping the significance of attributes, relations, and word order. Recent Vision-Language Models (VLMs), comprising a visual encoder and a Large Language Model (LLM) decoder, have demonstrated remarkable proficiency in such reasoning tasks. This prompts a crucial question: have VLMs effectively tackled the CR challenge? We conjecture that existing CR benchmarks may not adequately push the boundaries of modern VLMs due to the reliance on an LLM-only negative text generation pipeline. Consequently, the negatives produced either appear as outliers from the natural language distribution learned by VLMs' LLM decoders or as improbable within the corresponding image context. To address these limitations, we introduce ConMe -- a compositional reasoning benchmark and a novel data generation pipeline leveraging VLMs to produce `hard CR Q&A'. Through a new concept of VLMs conversing with each other to collaboratively expose their weaknesses, our pipeline autonomously generates, evaluates, and selects challenging compositional reasoning questions, establishing a robust CR benchmark, also subsequently validated manually. Our benchmark provokes a noteworthy, up to 33%, decrease in CR performance compared to preceding benchmarks, reinstating the CR challenge even for state-of-the-art VLMs."
"Grounding Everything: Emerging Localization Properties in Vision-Language Transformers.","2024","CVPR","Walid Bousselham, Felix Petersen, Vittorio Ferrari, Hilde Kuehne","Conference and Workshop Papers","https://dblp.org/rec/conf/cvpr/BousselhamPFK24",""
"LeGrad: An Explainability Method for Vision Transformers via Feature Formation Sensitivity.","2024","CoRR","Walid Bousselham, Angie W. Boggust, Sofian Chaybouti, Hendrik Strobelt, Hilde Kuehne","Informal and Other Publications","https://dblp.org/rec/journals/corr/abs-2404-03214","Vision Transformers (ViTs), with their ability to model long-range dependencies through self-attention mechanisms, have become a standard architecture in computer vision. However, the interpretability of these models remains a challenge. To address this, we propose LeGrad, an explainability method specifically designed for ViTs. LeGrad computes the gradient with respect to the attention maps of ViT layers, considering the gradient itself as the explainability signal. We aggregate the signal over all layers, combining the activations of the last as well as intermediate tokens to produce the merged explainability map. This makes LeGrad a conceptually simple and an easy-to-implement tool for enhancing the transparency of ViTs. We evaluate LeGrad in challenging segmentation, perturbation, and open-vocabulary settings, showcasing its versatility compared to other SotA explainability methods demonstrating its superior spatial fidelity and robustness to perturbations. A demo and the code is available at https://github.com/WalBouss/LeGrad."
"MaskInversion: Localized Embeddings via Optimization of Explainability Maps.","2024","CoRR","Walid Bousselham, Sofian Chaybouti, Christian Rupprecht 0001, Vittorio Ferrari, Hilde Kuehne","Informal and Other Publications","https://dblp.org/rec/journals/corr/abs-2407-20034","Vision-language foundation models such as CLIP have achieved tremendous results in global vision-language alignment, but still show some limitations in creating representations for specific image regions. % To address this problem, we propose MaskInversion, a method that leverages the feature representations of pre-trained foundation models, such as CLIP, to generate a context-aware embedding for a query image region specified by a mask at test time. MaskInversion starts with initializing an embedding token and compares its explainability map, derived from the foundation model, to the query mask. The embedding token is then subsequently refined to approximate the query region by minimizing the discrepancy between its explainability map and the query mask. During this process, only the embedding vector is updated, while the underlying foundation model is kept frozen allowing to use MaskInversion with any pre-trained model. As deriving the explainability map involves computing its gradient, which can be expensive, we propose a gradient decomposition strategy that simplifies this computation. The learned region representation can be used for a broad range of tasks, including open-vocabulary class retrieval, referring expression comprehension, as well as for localized captioning and image generation. We evaluate the proposed method on all those tasks on several datasets such as PascalVOC, MSCOCO, RefCOCO, and OpenImagesV7 and show its capabilities compared to other SOTA approaches."
"Meta-Prompting for Automating Zero-shot Visual Recognition with LLMs.","2024","CoRR","Muhammad Jehanzeb Mirza, Leonid Karlinsky, Wei Lin 0019, Sivan Doveh, Jakub Micorek, Mateusz Kozinski, Hilde Kuehne, Horst Possegger","Informal and Other Publications","https://dblp.org/rec/journals/corr/abs-2403-11755",""
"Uncertainty Quantification via Stable Distribution Propagation.","2024","ICLR","Felix Petersen, Aashwin Ananda Mishra, Hilde Kuehne, Christian Borgelt, Oliver Deussen, Mikhail Yurochkin","Conference and Workshop Papers","https://dblp.org/rec/conf/iclr/PetersenMKBDY24","We propose a new approach for propagating stable probability distributions through neural networks. Our method is based on local linearization, which we show to be an optimal approximation in terms of total variation distance for the ReLU non-linearity. This allows propagating Gaussian and Cauchy input uncertainties through neural networks to quantify their output uncertainties. To demonstrate the utility of propagating distributions, we apply the proposed method to predicting calibrated confidence intervals and selective prediction on out-of-distribution data. The results demonstrate a broad applicability of propagating distributions and show the advantages of our method over other approaches such as moment matching."
"What, When, and Where? Self-Supervised Spatio- Temporal Grounding in Untrimmed Multi-Action Videos from Narrated Instructions.","2024","CVPR","Brian Chen 0001, Nina Shvetsova, Andrew Rouditchenko, Daniel Kondermann, Samuel Thomas 0001, Shih-Fu Chang, Rogério Feris, James R. Glass, Hilde Kuehne","Conference and Workshop Papers","https://dblp.org/rec/conf/cvpr/0001SRK0CFGK24","Spatio-temporal grounding describes the task of localizing events in space and time, e.g., in video data, based on verbal descriptions only. Models for this task are usually trained with human-annotated sentences and bounding box supervision. This work addresses this task from a multimodal supervision perspective, proposing a framework for spatio-temporal action grounding trained on loose video and subtitle supervision only, without human annotation. To this end, we combine local representation learning, which focuses on leveraging fine-grained spatial information, with a global representation encoding that captures higher-level representations and incorporates both in a joint approach. To evaluate this challenging task in a real-life setting, a new benchmark dataset is proposed, providing dense spatio-temporal grounding annotations in long, untrimmed, multi-action instructional videos for over 5K events. We evaluate the proposed approach and other methods on the proposed and standard downstream tasks, showing that our method improves over current baselines in various settings, including spatial, temporal, and untrimmed multi-action spatio-temporal grounding."
"Whisper-Flamingo: Integrating Visual Features into Whisper for Audio-Visual Speech Recognition and Translation.","2024","CoRR","Andrew Rouditchenko, Yuan Gong 0001, Samuel Thomas 0001, Leonid Karlinsky, Hilde Kuehne, Rogério Feris, James R. Glass","Informal and Other Publications","https://dblp.org/rec/journals/corr/abs-2406-10082","Audio-Visual Speech Recognition (AVSR) uses lip-based video to improve performance in noise. Since videos are harder to obtain than audio, the video training data of AVSR models is usually limited to a few thousand hours. In contrast, speech models such as Whisper are trained with hundreds of thousands of hours of data, and thus learn a better speech-to-text decoder. The huge training data difference motivates us to adapt Whisper to handle video inputs. Inspired by Flamingo which injects visual features into language models, we propose Whisper-Flamingo which integrates visual features into the Whisper speech recognition and translation model with gated cross attention. Our audio-visual Whisper-Flamingo outperforms audio-only Whisper on English speech recognition and En-X translation for 6 languages in noisy conditions. Moreover, Whisper-Flamingo is a versatile model and conducts all of these tasks using one set of parameters, while prior methods are trained separately on each language."
"C2KD: Cross-Lingual Cross-Modal Knowledge Distillation for Multilingual Text-Video Retrieval.","2023","ICASSP","Andrew Rouditchenko, Yung-Sung Chuang, Nina Shvetsova, Samuel Thomas 0001, Rogério Feris, Brian Kingsbury, Leonid Karlinsky, David Harwath, Hilde Kuehne, James R. Glass","Conference and Workshop Papers","https://dblp.org/rec/conf/icassp/RouditchenkoCSTFKKHKG23","Multilingual text-video retrieval methods have improved significantly in recent years, but the performance for languages other than English still lags. We propose a Cross-Lingual Cross-Modal Knowledge Distillation method to improve multilingual text-video retrieval. Inspired by the fact that English text-video retrieval outperforms other languages, we train a student model using input text in different languages to match the cross-modal predictions from teacher models using input text in English. We propose a cross entropy based objective which forces the distribution over the student’s text-video similarity scores to be similar to those of the teacher models. We introduce a new multilingual video dataset, Multi-YouCook2, by translating the English captions in the YouCook2 video dataset to 8 other languages. Our method improves multilingual text-video retrieval performance on Multi-YouCook2 and several other datasets such as Multi-MSRVTT and VATEX. We also conducted an analysis on the effectiveness of different multilingual text models as teachers."
"Comparison of Multilingual Self-Supervised and Weakly-Supervised Speech Pre-Training for Adaptation to Unseen Languages.","2023","INTERSPEECH","Andrew Rouditchenko, Sameer Khurana, Samuel Thomas 0001, Rogério Feris, Leonid Karlinsky, Hilde Kuehne, David Harwath, Brian Kingsbury, James R. Glass","Conference and Workshop Papers","https://dblp.org/rec/conf/interspeech/RouditchenkoK0F23","Recent models such as XLS-R and Whisper have made multilingual speech technologies more accessible by pre-training on audio from around 100 spoken languages each. However, there are thousands of spoken languages worldwide, and adapting to new languages is an important problem. In this work, we aim to understand which model adapts better to languages unseen during pre-training. We fine-tune both models on 13 unseen languages and 18 seen languages. Our results show that the number of hours seen per language and language family during pre-training is predictive of how the models compare, despite the significant differences in the pre-training methods."
"Contrastive Audio-Visual Masked Autoencoder.","2023","ICLR","Yuan Gong 0001, Andrew Rouditchenko, Alexander H. Liu, David Harwath, Leonid Karlinsky, Hilde Kuehne, James R. Glass","Conference and Workshop Papers","https://dblp.org/rec/conf/iclr/GongRLHKKG23","In this paper, we first extend the recent Masked Auto-Encoder (MAE) model from a single modality to audio-visual multi-modalities. Subsequently, we propose the Contrastive Audio-Visual Masked Auto-Encoder (CAV-MAE) by combining contrastive learning and masked data modeling, two major self-supervised learning frameworks, to learn a joint and coordinated audio-visual representation. Our experiments show that the contrastive audio-visual correspondence learning objective not only enables the model to perform audio-visual retrieval tasks, but also helps the model learn a better joint representation. As a result, our fully self-supervised pretrained CAV-MAE achieves a new SOTA accuracy of 65.9% on VGGSound, and is comparable with the previous best supervised pretrained model on AudioSet in the audio-visual event classification task. Code and pretrained models are at https://github.com/yuangongnd/cav-mae."
"ISAAC Newton: Input-based Approximate Curvature for Newton's Method.","2023","ICLR","Felix Petersen, Tobias Sutter, Christian Borgelt, Dongsung Huh, Hilde Kuehne, Yuekai Sun, Oliver Deussen","Conference and Workshop Papers","https://dblp.org/rec/conf/iclr/PetersenSBHKSD23","We present ISAAC (Input-baSed ApproximAte Curvature), a novel method that conditions the gradient using selected second-order information and has an asymptotically vanishing computational overhead, assuming a batch size smaller than the number of neurons. We show that it is possible to compute a good conditioner based on only the input to a respective layer without a substantial computational overhead. The proposed method allows effective training even in small-batch stochastic regimes, which makes it competitive to first-order as well as second-order methods."
"In-Style: Bridging Text and Uncurated Videos with Style Transfer for Text-Video Retrieval.","2023","ICCV","Nina Shvetsova, Anna Kukleva, Bernt Schiele, Hilde Kuehne","Conference and Workshop Papers","https://dblp.org/rec/conf/iccv/ShvetsovaKSK23","Large-scale noisy web image-text datasets have been proven to be efficient for learning robust vision-language models. However, to transfer them to the task of video retrieval, models still need to be fine-tuned on hand-curated paired text-video data to adapt to the diverse styles of video descriptions. To address this problem without the need for hand-annotated pairs, we propose a new setting, text-video retrieval with uncurated & unpaired data, that uses only text queries together with uncurated web videos during training without any paired text-video data. To this end, we propose an approach, In-Style, that learns the style of the text queries and transfers it to uncurated web videos. Moreover, to improve generalization, we show that one model can be trained with multiple text styles. To this end, we introduce a multi-style contrastive training procedure, that improves the generalizability over several datasets simultaneously. We evaluate our model on retrieval performance over multiple datasets to demonstrate the advantages of our style transfer framework on the new task of uncurated & unpaired text-video retrieval and improve state-of-the-art performance on zero-shot text-video retrieval.1"
"Learning Situation Hyper-Graphs for Video Question Answering.","2023","CVPR","Aisha Urooj Khan, Hilde Kuehne, Bo Wu 0018, Kim Chheu, Walid Bousselham, Chuang Gan, Niels da Vitoria Lobo, Mubarak Shah","Conference and Workshop Papers","https://dblp.org/rec/conf/cvpr/KhanK0CBGLS23","Answering questions about complex situations in videos requires not only capturing the presence of actors, objects, and their relations but also the evolution of these relationships over time. A situation hyper-graph is a representation that describes situations as scene sub-graphs for video frames and hyper-edges for connected sub-graphs and has been proposed to capture all such information in a compact structured form. In this work, we propose an architecture for Video Question Answering (VQA) that enables answering questions related to video content by predicting situation hyper-graphs, coined Situation Hyper-Graph based Video Question Answering (SHG- VQA). To this end, we train a situation hyper-graph decoder to implicitly identify graph representations with actions and object/human-object relationships from the input video clip. and to use cross-attention between the predicted situation hyper-graphs and the question embedding to predict the correct answer. The proposed method is trained in an end-to-end manner and optimized by a VQA loss with the cross-entropy function and a Hungarian matching loss for the situation graph prediction. The effectiveness of the proposed architecture is extensively evaluated on two challenging benchmarks: AGQA and STAR. Our results show that learning the underlying situation hyper-graphs helps the system to significantly improve its performance for novel challenges of video question-answering tasks11Code will be available at https://github.com/aurooj/SHG-VQA."
"Learning by Sorting: Self-supervised Learning with Group Ordering Constraints.","2023","ICCV","Nina Shvetsova, Felix Petersen, Anna Kukleva, Bernt Schiele, Hilde Kuehne","Conference and Workshop Papers","https://dblp.org/rec/conf/iccv/ShvetsovaPKSK23","Contrastive learning has become an important tool in learning representations from unlabeled data mainly relying on the idea of minimizing distance between positive data pairs, e.g., views from the same images, and maximizing distance between negative data pairs, e.g., views from different images. This paper proposes a new variation of the contrastive learning objective, Group Ordering Constraints (GroCo), that leverages the idea of sorting the distances of positive and negative pairs and computing the respective loss based on how many positive pairs have a larger distance than the negative pairs, and thus are not ordered correctly. To this end, the GroCo loss is based on differentiable sorting networks, which enable training with sorting supervision by matching a differentiable permutation matrix, which is produced by sorting a given set of scores, to a respective ground truth permutation matrix. Applying this idea to groupwise pre-ordered inputs of multiple positive and negative pairs allows introducing the GroCo loss with implicit emphasis on strong positives and negatives, leading to better optimization of the local neighborhood. We evaluate the proposed formulation on various self-supervised learning benchmarks and show that it not only leads to improved results compared to vanilla contrastive learning but also shows competitive performance to comparable methods in linear probing and outperforms current methods in k-NN performance. 1"
"MAtch, eXpand and Improve: Unsupervised Finetuning for Zero-Shot Action Recognition with Language Knowledge.","2023","ICCV","Wei Lin 0019, Leonid Karlinsky, Nina Shvetsova, Horst Possegger, Mateusz Kozinski, Rameswar Panda, Rogério Feris, Hilde Kuehne, Horst Bischof","Conference and Workshop Papers","https://dblp.org/rec/conf/iccv/0019KSPKPFKB23","Large scale Vision Language (VL) models have shown tremendous success in aligning representations between visual and text modalities. This enables remarkable progress in zero-shot recognition, image generation & editing, and many other exciting tasks. However, VL models tend to over-represent objects while paying much less attention to verbs, and require additional tuning on video data for best zero-shot action recognition performance. While previous work relied on large-scale, fully-annotated data, in this work we propose an unsupervised approach. We adapt a VL model for zero-shot and few-shot action recognition using a collection of unlabeled videos and an unpaired action dictionary. Based on that, we leverage Large Language Models and VL models to build a text bag for each unlabeled video via matching, text expansion and captioning. We use those bags in a Multiple Instance Learning setup to adapt an image-text backbone to video data. Although finetuned on unlabeled video data, our resulting models demonstrate high transferability to numerous unseen zero-shot downstream tasks, improving the base VL model performance by up to 14%, and even comparing favorably to fully-supervised baselines in both zero-shot and few-shot video recognition transfer. The code is released at https://github.com/wlin-at/MAXI."
"Preserving Modality Structure Improves Multi-Modal Learning.","2023","ICCV","Sirnam Swetha, Mamshad Nayeem Rizve, Nina Shvetsova, Hilde Kuehne, Mubarak Shah","Conference and Workshop Papers","https://dblp.org/rec/conf/iccv/SwethaRSKS23","Self-supervised learning on large-scale multi-modal datasets allows learning semantically meaningful embeddings in a joint multi-modal representation space without relying on human annotations. These joint embeddings enable zero-shot cross-modal tasks like retrieval and classification. However, these methods often struggle to generalize well on out-of-domain data as they ignore the semantic structure present in modality-specific embeddings. In this context, we propose a novel Semantic-Structure-Preserving Consistency approach to improve generalizability by preserving the modality-specific relationships in the joint embedding space. To capture modality-specific semantic relationships between samples, we propose to learn multiple anchors and represent the multifaceted relationship between samples with respect to their relationship with these anchors. To assign multiple anchors to each sample, we propose a novel Multi-Assignment Sinkhorn-Knopp algorithm. Our experimentation demonstrates that our proposed approach learns semantically meaningful anchors in a self-supervised manner. Furthermore, our evaluation on MSR-VTT and YouCook2 datasets demonstrates that our proposed multi-anchor assignment based solution achieves state-of-the-art performance and generalizes to both in-and out-of-domain datasets. Code: https://github.com/Swetha5/Multi_Sinkhorn_Knopp"
"TAEC: Unsupervised Action Segmentation with Temporal-Aware Embedding and Clustering.","2023","CVWW","Wei Lin 0019, Anna Kukleva, Horst Possegger, Hilde Kuehne, Horst Bischof","Conference and Workshop Papers","https://dblp.org/rec/conf/cvww/LinKPKB23","Temporal action segmentation in untrimmed videos has gained increased attention recently. However, annotating action classes and frame-wise boundaries is extremely time consuming and cost intensive, especially on large-scale datasets. To address this issue, we propose an unsupervised approach for learning action classes from untrimmed video sequences. In particular, we propose a temporal embedding network that combines relative time prediction, feature reconstruction, and sequence-to-sequence learning, to preserve the spatial layout and sequential nature of the video features. A two-step clustering pipeline on these embedded feature representations then allows us to enforce temporal consistency within, as well as across videos. Based on the identified clusters, we decode the video into coherent temporal segments that correspond to semantically meaningful action classes. Our evaluation on three challenging datasets shows the impact of each component and, furthermore, demonstrates our state-of-the-art unsupervised action segmentation results."
"Temperature Schedules for self-supervised contrastive methods on long-tail data.","2023","ICLR","Anna Kukleva, Moritz Böhle, Bernt Schiele, Hilde Kuehne, Christian Rupprecht 0001","Conference and Workshop Papers","https://dblp.org/rec/conf/iclr/KuklevaBSK023","Most approaches for self-supervised learning (SSL) are optimised on curated balanced datasets, e.g. ImageNet, despite the fact that natural data usually exhibits long-tail distributions. In this paper, we analyse the behaviour of one of the most popular variants of SSL, i.e. contrastive methods, on long-tail data. In particular, we investigate the role of the temperature parameter $\tau$ in the contrastive loss, by analysing the loss through the lens of average distance maximisation, and find that a large $\tau$ emphasises group-wise discrimination, whereas a small $\tau$ leads to a higher degree of instance discrimination. While $\tau$ has thus far been treated exclusively as a constant hyperparameter, in this work, we propose to employ a dynamic $\tau$ and show that a simple cosine schedule can yield significant improvements in the learnt representations. Such a schedule results in a constant `task switching' between an emphasis on instance discrimination and group-wise discrimination and thereby ensures that the model learns both group-wise features, as well as instance-specific details. Since frequent classes benefit from the former, while infrequent classes require the latter, we find this method to consistently improve separation between the classes in long-tail data without any additional computational cost."
"Video Test-Time Adaptation for Action Recognition.","2023","CVPR","Wei Lin 0019, Muhammad Jehanzeb Mirza, Mateusz Kozinski, Horst Possegger, Hilde Kuehne, Horst Bischof","Conference and Workshop Papers","https://dblp.org/rec/conf/cvpr/LinMKPKB23",""
