"title","year","venue","authors","type","url","abstract"
"15.4 Self-Enabled Write-Assist Cells for High-Density SRAM in a Resistance-Dominated Technology Node.","2024","ISSCC","Minjune Yeo, Keonhee Cho, Giseok Kim, Won Joon Jo, Jisang Oh, Sekeon Kim, Kyeongrim Baek, Sungho Park, Seung Jae Yei, Seong-Ook Jung","Conference and Workshop Papers","https://dblp.org/rec/conf/isscc/YeoCKJOKBPYJ24","For applications where a significant amount of data is processed within a limited area, such as mobile and graphics applications, the demand for higher-density SRAM becomes more evident [1]. As shown in Fig. 15.4.1 (top left), SRAM cell area is progressively decreasing with technology scaling to achieve high-density [2]. However, in sub-5nm technology nodes, shown in Fig. 15.4.1 (top right), the reduction of the interconnect cross-sectional area and decreased electron mobility, due to grain boundary scattering and surface scattering, leads to an exponential increase in interconnect resistance. Despite scaling-driven BL length reduction an exponential increase in interconnect resistance results in an increase in the BL resistance per cell $(\mathrm{R}_{\mathrm{BL} \_ \text {cell }})$, resulting in writability degradation. Figure 15.4.1 (bottom) shows the $\mathrm{R}_{\mathrm{BL} \_ \text {cell }}$ and BL capacitance per cell $(\mathrm{C}_{\mathrm{BL} \_ \text {cell }})$ for recent work using sub-5nm technology nodes. As shown in Fig. 15.4.2, the voltage of BL (or BLB) connected to the selected cell $(\mathrm{V}_{\mathrm{BL} \_ \text {cell }})$ is determined by the voltage dividing characteristic from the cell supply voltage $(\mathrm{V}_{DD_{-}C})$, in the selected cell, to the ground voltage (VSS), in write driver (WD), during a write operation. As RBL becomes larger, so does $\mathrm{V}_{\mathrm{BL} \_ \text {cell }}$. An increased $\mathrm{V}_{\mathrm{BL} \_ \text {cell }}$ reduces the write current through the pass-gate transistor (PG), resulting in write failures."
"A 3.5 to 4.7-GHz Fractional-N ADPLL With a Low-Power Time-Interleaved GRO-TDC of 6.2-ps Resolution in 65-nm CMOS Process.","2024","IEEE Access","Kyoung-Ub Cho, Joonho Gil, Chulhyun Park, Kyu-Jin Cho, Jaewoo Shin, Eun Seong Kim, Yun Seong Eo, Ramesh Harjani, Nam-Young Kim, Taehyoun Oh","Journal Articles","https://dblp.org/rec/journals/access/ChoGPCSKEHKO24","This paper proposes a low-power design method and a low-noise phase offset calibration technique for a gated ring-oscillator time-to-digital converter (GRO-TDC), which normally consumes a large percentage of most all-digital phase-locked loop (ADPLL) power. A single coarse counter logic structure along with time-interleaved even/odd paths significantly reduces the complexity and speed of the TDC logic. The proposed TDC consumes only 0.44 to 24 mW for 0.077 to 24.42 ns of detection range. The multi-path GRO accelerates the oscillation speed and achieves approximately 6.2 ps of time resolution. The GRO-TDC shows –1.43 to 1.35 least-significant bits (LSB) of differential non-linearity (DNL) and –1.32 to 1.96 LSB of integral non-linearity (INL) over a 11-bit dynamic range (DR). The entire ADPLL including the proposed TDC has been fabricated in a 65 nm CMOS process and occupies 0.67 mm2 of active area. The prototype ADPLL consumes 12.22 mW from 1.2 V supply and the TDC consumes only 0.65 mW for a 50-phase offset code. A modified integrating structure in the subsequent digital loop filter (DLF) has been developed to mitigate dithering noise on $V_{ctrl}$ code and the measured reference spur is –69.38 dBc at 3.6 GHz center frequency. The tuning range of the implemented ADPLL is 3.5 to 4.7 GHz by using 2-bit band switching and 5-bit coarse control, while maintaining low- $K_{DCO}$ values to suppress in-band quantization noise. The measured root-mean-square (RMS) jitter is 0.94 ps and 0.99 ps at 3.6 GHz integer-mode and 3.60743 GHz fractional-mode respectively."
"Benchmarking Uncertainty Disentanglement: Specialized Uncertainties for Specialized Tasks.","2024","CoRR","Bálint Mucsányi, Michael Kirchhof, Seong Joon Oh","Informal and Other Publications","https://dblp.org/rec/journals/corr/abs-2402-19460",""
"Calibrating Large Language Models Using Their Generations Only.","2024","ACL","Dennis Ulmer, Martin Gubri, Hwaran Lee, Sangdoo Yun, Seong Joon Oh","Conference and Workshop Papers","https://dblp.org/rec/conf/acl/UlmerGLYO24","As large language models (LLMs) are increasingly deployed in user-facing applications, building trust and maintaining safety by accurately quantifying a model's confidence in its prediction becomes even more important. However, finding effective ways to calibrate LLMs - especially when the only interface to the models is their generated text - remains a challenge. We propose APRICOT (auxiliary prediction of confidence targets): A method to set confidence targets and train an additional model that predicts an LLM's confidence based on its textual input and output alone. This approach has several advantages: It is conceptually simple, does not require access to the target model beyond its output, does not interfere with the language generation, and has a multitude of potential usages, for instance by verbalizing the predicted confidence or adjusting the given answer based on the confidence. We show how our approach performs competitively in terms of calibration error for white-box and black-box LLMs on closed-book question-answering to detect incorrect LLM answers."
"HyperCLOVA X Technical Report.","2024","CoRR","Kang Min Yoo, Jaegeun Han, Sookyo In, Heewon Jeon, Jisu Jeong, Jaewook Kang, Hyunwook Kim, Kyung-Min Kim, Munhyong Kim, Sungju Kim, Donghyun Kwak, Hanock Kwak, Se Jung Kwon, Bado Lee, Dongsoo Lee, Gichang Lee, Jooho Lee, Baeseong Park, Seongjin Shin, Joonsang Yu, Seolki Baek, Sumin Byeon, Eungsup Cho, Dooseok Choe, Jeeseung Han, Youngkyun Jin, Hyein Jun, Jaeseung Jung, Chanwoong Kim, Jinhong Kim, Jinuk Kim, Dokyeong Lee, Dong Wook Park, Jeong Min Sohn, Sujung Han, Jiae Heo, Sungju Hong, Mina Jeon, Hyunhoon Jung, Jungeun Jung, Wangkyo Jung, Chungjoon Kim, Hyeri Kim, Jonghyun Kim, Min Young Kim, Soeun Lee, Joonhee Park, Jieun Shin, Sojin Yang, Jungsoon Yoon, Hwaran Lee, Sanghwan Bae, Jeehwan Cha, Karl Gylleus, Donghoon Ham, Mihak Hong, Youngki Hong, Yunki Hong, Dahyun Jang, Hyojun Jeon, Yujin Jeon, Yeji Jeong, Myunggeun Ji, Yeguk Jin, Chansong Jo, Shinyoung Joo, Seunghwan Jung, Adrian Jungmyung Kim, Byoung Hoon Kim, Hyomin Kim, Jungwhan Kim, Minkyoung Kim, Minseung Kim, Sungdong Kim, Yonghee Kim, Youngjun Kim, Youngkwan Kim, Donghyeon Ko, Dughyun Lee, Hayoung Lee, Jaehong Lee, Jieun Lee, Jonghyun Lee, Jongjin Lee, Min Young Lee, Yehbin Lee, Taehong Min, Yuri Min, Kiyoon Moon, Hyangnam Oh, Jaesun Park, Kyuyon Park, Younghun Park, Hanbae Seo, Seunghyun Seo, Mihyun Sim, Gyubin Son, Matt Yeo, Kyung Hoon Yeom, Wonjoon Yoo","Informal and Other Publications","https://dblp.org/rec/journals/corr/abs-2404-01954","We introduce HyperCLOVA X, a family of large language models (LLMs) tailored to the Korean language and culture, along with competitive capabilities in English, math, and coding. HyperCLOVA X was trained on a balanced mix of Korean, English, and code data, followed by instruction-tuning with high-quality human-annotated datasets while abiding by strict safety guidelines reflecting our commitment to responsible AI. The model is evaluated across various benchmarks, including comprehensive reasoning, knowledge, commonsense, factuality, coding, math, chatting, instruction-following, and harmlessness, in both Korean and English. HyperCLOVA X exhibits strong reasoning capabilities in Korean backed by a deep understanding of the language and cultural nuances. Further analysis of the inherent bilingual nature and its extension to multilingualism highlights the model's cross-lingual proficiency and strong generalization ability to untargeted languages, including machine translation between several language pairs and cross-lingual inference tasks. We believe that HyperCLOVA X can provide helpful guidance for regions or countries in developing their sovereign LLMs."
"INSTRUCTIR: A Benchmark for Instruction Following of Information Retrieval Models.","2024","CoRR","Hanseok Oh, Hyunji Lee, Seonghyeon Ye, Haebin Shin, Hansol Jang, Changwook Jun, Minjoon Seo","Informal and Other Publications","https://dblp.org/rec/journals/corr/abs-2402-14334",""
"LR-FHSS Transceiver for Direct-to-Satellite IoT Communications: Design, Implementation, and Verification.","2024","CoRR","Sooyeob Jung, Seongah Jeong, Jinkyu Kang, Gyeongrae Im, Sangjae Lee, Mi-Kyung Oh, Joon-Gyu Ryu, Joonhyuk Kang","Informal and Other Publications","https://dblp.org/rec/journals/corr/abs-2403-14154",""
"Pretrained Visual Uncertainties.","2024","CoRR","Michael Kirchhof, Mark Collier, Seong Joon Oh, Enkelejda Kasneci","Informal and Other Publications","https://dblp.org/rec/journals/corr/abs-2402-16569","Accurate uncertainty estimation is vital to trustworthy machine learning, yet uncertainties typically have to be learned for each task anew. This work introduces the first pretrained uncertainty modules for vision models. Similar to standard pretraining this enables the zero-shot transfer of uncertainties learned on a large pretraining dataset to specialized downstream datasets. We enable our large-scale pretraining on ImageNet-21k by solving a gradient conflict in previous uncertainty modules and accelerating the training by up to 180x. We find that the pretrained uncertainties generalize to unseen datasets. In scrutinizing the learned uncertainties, we find that they capture aleatoric uncertainty, disentangled from epistemic components. We demonstrate that this enables safe retrieval and uncertainty-aware dataset visualization. To encourage applications to further problems and domains, we release all pretrained checkpoints and code under https://github.com/mkirchhof/url ."
"SNNSim: Investigation and Optimization of Large-Scale Analog Spiking Neural Networks Based on Flash Memory Devices.","2024","Adv. Intell. Syst.","JongHyun Ko, Dongseok Kwon, Joon Hwang, Kyu-Ho Lee, Seongbin Oh, Jeonghyun Kim, Jiseong Im, Ryun-Han Koo, Jae-Joon Kim, Jong-Ho Lee 0002","Journal Articles","https://dblp.org/rec/journals/aisy/KoKHLOKIKKL24","Spiking neural networks (SNNs) have emerged as a novel approach for reducing computational costs by mimicking the biologically plausible operations of neurons and synapses. In this article, large‐scale analog SNNs are investigated and optimized at the hardware‐level by using SNNSim, the novel simulator for SNNs that employ analog synaptic devices and integrate‐and‐fire (I&F) neuron circuits. SNNSim is a reconfigurable simulator that accurately and very quickly models the behavior of the user‐defined device characteristics and returns key metrics such as area, accuracy, latency, and power consumption as output. Notably, SNNSim exhibits exceptional efficiency, as it can process the entire 10 000 Modified National Institute of Standards and Technology (MNIST) test dataset in a few seconds, whereas SPICE simulations require hours to simulate a single MNIST test data. Using SNNSim, the conversion of artificial neural networks (ANNs) to SNNs is simulated and the performance of the large‐scale analog SNNs is optimized. The results enable the design of accurate, high‐speed, and low‐power operation of large‐scale SNNs. SNNSim code is now available at https://github.com/SMDLGITHUB/SNNSim."
"TRAP: Targeted Random Adversarial Prompt Honeypot for Black-Box Identification.","2024","ACL","Martin Gubri, Dennis Ulmer, Hwaran Lee, Sangdoo Yun, Seong Joon Oh","Conference and Workshop Papers","https://dblp.org/rec/conf/acl/GubriULYO24","Large Language Model (LLM) services and models often come with legal rules on who can use them and how they must use them. Assessing the compliance of the released LLMs is crucial, as these rules protect the interests of the LLM contributor and prevent misuse. In this context, we describe the novel fingerprinting problem of Black-box Identity Verification (BBIV). The goal is to determine whether a third-party application uses a certain LLM through its chat function. We propose a method called Targeted Random Adversarial Prompt (TRAP) that identifies the specific LLM in use. We repurpose adversarial suffixes, originally proposed for jailbreaking, to get a pre-defined answer from the target LLM, while other models give random answers. TRAP detects the target LLMs with over 95% true positive rate at under 0.2% false positive rate even after a single interaction. TRAP remains effective even if the LLM has minor changes that do not significantly alter the original function."
"The BiGGen Bench: A Principled Benchmark for Fine-grained Evaluation of Language Models with Language Models.","2024","CoRR","Seungone Kim, Juyoung Suk, Ji Yong Cho, Shayne Longpre, Chaeeun Kim, Dongkeun Yoon, Guijin Son, Yejin Choi 0001, Sheikh Shafayat, Jinheon Baek, Sue Hyun Park, Hyeonbin Hwang, Jinkyung Jo, Hyowon Cho, Haebin Shin, Seongyun Lee, Hanseok Oh, Noah Lee, Namgyu Ho, Se June Joo, Miyoung Ko, Yoonjoo Lee, Hyungjoo Chae, Jamin Shin, Joel Jang, Seonghyeon Ye, Bill Yuchen Lin, Sean Welleck, Graham Neubig, Moontae Lee, Kyungjae Lee 0002, Minjoon Seo","Informal and Other Publications","https://dblp.org/rec/journals/corr/abs-2406-05761","As language models (LMs) become capable of handling a wide range of tasks, their evaluation is becoming as challenging as their development. Most generation benchmarks currently assess LMs using abstract evaluation criteria like helpfulness and harmlessness, which often lack the flexibility and granularity of human assessment. Additionally, these benchmarks tend to focus disproportionately on specific capabilities such as instruction following, leading to coverage bias. To overcome these limitations, we introduce the BiGGen Bench, a principled generation benchmark designed to thoroughly evaluate nine distinct capabilities of LMs across 77 diverse tasks. A key feature of the BiGGen Bench is its use of instance-specific evaluation criteria, closely mirroring the nuanced discernment of human evaluation. We apply this benchmark to assess 103 frontier LMs using five evaluator LMs. Our code, data, and evaluation results are all publicly available at https://github.com/prometheus-eval/prometheus-eval/tree/main/BiGGen-Bench."
"A 1.1V 16Gb DDR5 DRAM with Probabilistic-Aggressor Tracking, Refresh-Management Functionality, Per-Row Hammer Tracking, a Multi-Step Precharge, and Core-Bias Modulation for Security and Reliability Enhancement.","2023","ISSCC","Woongrae Kim, Chulmoon Jung, Seong Nyuh Yoo, Duckhwa Hong, Jeongjin Hwang, Jungmin Yoon, Oh-Yong Jung, Joonwoo Choi, Sanga Hyun, Mankeun Kang, Sangho Lee, Dohong Kim, Sanghyun Ku, Donhyun Choi, Nogeun Joo, Sangwoo Yoon, Junseok Noh, Byeongyong Go, Cheolhoe Kim, Sunil Hwang, Mihyun Hwang, Seol-Min Yi, Hyungmin Kim, Sanghyuk Heo, Yeonsu Jang, Kyoungchul Jang, Shinho Chu, Yoonna Oh, Kwidong Kim, Junghyun Kim, Soohwan Kim, Jeongtae Hwang, Sangil Park, Junphyo Lee, In-Chul Jeong, Joohwan Cho, Jonghwan Kim","Conference and Workshop Papers","https://dblp.org/rec/conf/isscc/KimJYHHYJCHKLKKCJYNGKHHYKHJJCOKKKHPLJ23","DRAM products have been recently adopted in a wide range of high-performance computing applications: such as in cloud computing, in big data systems, and loT devices. This demand creates larger memory capacity requirements, thereby requiring aggressive DRAM technology node scaling to reduce the cost per bit [1], [2]. However, DRAM manufacturers are facing technology scaling challenges due to row hammer and refresh retention time beyond 1a-nm [2]. Row hammer is a failure mechanism, where repeatedly activating a DRAM row disturbs data in adjacent rows. Scaling down severely threatens reliability since a reduction of DRAM cell size leads to a reduction in the intrinsic row hammer tolerance [2], [3]. To improve row hammer tolerance, there is a need to probabilistically activate adjacent rows with carefully sampled active addresses and to improve intrinsic row hammer tolerance [2]. In this paper, row-hammer-protection and refresh-management schemes are presented to guarantee DRAM security and reliability despite the aggressive scaling from 1a-nm to sub 10-nm nodes. The probabilistic-aggressor-tracking scheme with a refresh-management function (RFM) and per-tow hammer tracking (PRHT) improve DRAM resilience. A multi-step precharge reinforces intrinsic row-hammer tolerance and a core-bias modulation improves retention time: even in the face of cell-transistor degradation due to technology scaling. This comprehensive scheme leads to a reduced probability of failure, due to row hammer attacks, by 93.1% and an improvement in retention time by 17%."
"A Bayesian Approach To Analysing Training Data Attribution In Deep Learning.","2023","NeurIPS","Elisa Nguyen, Minjoon Seo, Seong Joon Oh","Conference and Workshop Papers","https://dblp.org/rec/conf/nips/NguyenSO23","Training data attribution (TDA) techniques find influential training data for the model's prediction on the test data of interest. They approximate the impact of down- or up-weighting a particular training sample. While conceptually useful, they are hardly applicable to deep models in practice, particularly because of their sensitivity to different model initialisation. In this paper, we introduce a Bayesian perspective on the TDA task, where the learned model is treated as a Bayesian posterior and the TDA estimates as random variables. From this novel viewpoint, we observe that the influence of an individual training sample is often overshadowed by the noise stemming from model initialisation and SGD batch composition. Based on this observation, we argue that TDA can only be reliably used for explaining deep model predictions that are consistently influenced by certain training data, independent of other noise factors. Our experiments demonstrate the rarity of such noise-independent training-test data pairs but confirm their existence. We recommend that future researchers and practitioners trust TDA estimates only in such cases. Further, we find a disagreement between ground truth and estimated TDA distributions and encourage future work to study this gap. Code is provided at https://github.com/ElisaNguyen/bayesian-tda."
"A Bayesian Perspective On Training Data Attribution.","2023","CoRR","Elisa Nguyen, Minjoon Seo, Seong Joon Oh","Informal and Other Publications","https://dblp.org/rec/journals/corr/abs-2305-19765","Training data attribution (TDA) techniques find influential training data for the model's prediction on the test data of interest. They approximate the impact of down- or up-weighting a particular training sample. While conceptually useful, they are hardly applicable to deep models in practice, particularly because of their sensitivity to different model initialisation. In this paper, we introduce a Bayesian perspective on the TDA task, where the learned model is treated as a Bayesian posterior and the TDA estimates as random variables. From this novel viewpoint, we observe that the influence of an individual training sample is often overshadowed by the noise stemming from model initialisation and SGD batch composition. Based on this observation, we argue that TDA can only be reliably used for explaining deep model predictions that are consistently influenced by certain training data, independent of other noise factors. Our experiments demonstrate the rarity of such noise-independent training-test data pairs but confirm their existence. We recommend that future researchers and practitioners trust TDA estimates only in such cases. Further, we find a disagreement between ground truth and estimated TDA distributions and encourage future work to study this gap. Code is provided at https://github.com/ElisaNguyen/bayesian-tda."
"An Arrhythmia Classification-Guided Segmentation Model for Electrocardiogram Delineation.","2023","CoRR","Chankyu Joung, Mijin Kim, Taejin Paik, Seong-Ho Kong, Seung-Young Oh, Won Kyeong Jeon, Jae-hu Jeon, Joong-Sik Hong, Wan-Joong Kim, Woong Kook, Myung-Jin Cha, Otto van Koert","Informal and Other Publications","https://dblp.org/rec/journals/corr/abs-2304-06237",". Accurate delineation of key waveforms in an ECG is a critical initial step in extracting relevant features to support the diagnosis and treatment of heart conditions. Although deep learning based methods using a segmentation model to locate P, QRS and T waves have shown promising results, their ability to handle signals exhibiting arrhythmia remains unclear. In this study, we propose a novel approach that leverages a deep learning model to accurately delineate signals with a wide range of arrhythmia. Our approach involves training a segmentation model using a hybrid loss function that combines segmentation with the task of arrhythmia classiﬁcation. In addition, we use a diverse training set containing various arrhythmia types, enabling our model to handle a wide range of challenging cases. Experimental results show that our model accurately delineates signals with a broad range of abnormal rhythm types, and the combined training with classiﬁcation guidance can eﬀec-tively reduce false positive P wave predictions, particularly during atrial ﬁbrillation and atrial ﬂutter. Furthermore, our proposed method shows competitive performance with previous delineation algorithms on the Lobachevsky University Database (LUDB)."
"ECG-QA: A Comprehensive Question Answering Dataset Combined With Electrocardiogram.","2023","NeurIPS","Jungwoo Oh, Gyubok Lee, Seongsu Bae, Joon-Myoung Kwon, Edward Choi","Conference and Workshop Papers","https://dblp.org/rec/conf/nips/OhLBKC23",""
"Enhancing Discriminative Ability among Similar Classes with Guidance of Text-Image Correlation for Unsupervised Domain Adaptation.","2023","IJCNN","Yu-Won Lee, Myeong-Seok Oh, Ho-Joong Kim, Seong-Whan Lee","Conference and Workshop Papers","https://dblp.org/rec/conf/ijcnn/LeeOKL23","In deep learning, unsupervised domain adaptation (UDA) is commonly utilized when the availability of abundant labeled data is often limited. Several methods have been proposed for UDA to overcome the difficulty of distinguishing between semantically similar classes, such as person vs. rider and road vs. sidewalk. The confusion of the classes results from the collapse of the distance, caused by the domain shift, between classes in the feature space. In this work, we present a versatile approach based on text-image correlation-guided domain adaptation (TigDA), which maintains a distance to properly adjust the decision boundaries between classes in the feature space. In our approach, the feature information is extracted through text embedding of classes and the aligning capability of the text features with the image features is achieved using the cross-modality. The resultant cross-modal features play an essential role in generating pseudo-labels and calculating an auxiliary pixel-wise cross-entropy loss to assist the image encoder in learning the distribution of cross-modal features. Such a guiding process allows the extension of the distance between similar classes in feature space so that a proper distance for adjusting the decision boundary is maintained. Our TigDA achieved the highest performance among other UDA methods in both single-resolution and multi-resolution cases with the help of GTA5 and SYNTHIA for the source domain and Cityscapes for the target domain. The simplicity and versatility of TigDA will be widely applicable for enhancing the self-training capabilities of most UDA methods."
"Neglected Free Lunch - Learning Image Classifiers Using Annotation Byproducts.","2023","ICCV","Dongyoon Han, Junsuk Choe, Seonghyeok Chun, John Joon Young Chung, Minsuk Chang, Sangdoo Yun, Jean Y. Song, Seong Joon Oh","Conference and Workshop Papers","https://dblp.org/rec/conf/iccv/HanCCCCYSO23","Supervised learning of image classifiers distills human knowledge into a parametric model fθ through pairs of images and corresponding labels $\left\{ {\left( {{X_i},{Y_i}} \right)} \right\}_{i = 1}^N$. We argue that this simple and widely used representation of human knowledge neglects rich auxiliary information from the annotation procedure, such as the time-series of mouse traces and clicks left after image selection. Our insight is that such annotation byproducts Z provide approximate human attention that weakly guides the model to focus on the foreground cues, reducing spurious correlations and discouraging shortcut learning. To verify this, we create ImageNet-AB and COCO-AB. They are ImageNet and COCO training sets enriched with sample-wise annotation byproducts, collected by replicating the respective original annotation tasks. We refer to the new paradigm of training models with annotation byproducts as learning using annotation byproducts (LUAB). We show that a simple multitask loss for regressing Z together with Y already improves the generalisability and robustness of the learned models. Compared to the original supervised learning, LUAB does not require extra annotation costs. ImageNet-AB and COCO-AB are at github.com/naverai/NeglectedFreeLunch."
