"title","year","venue","authors","type","url","abstract"
"A Looming Replication Crisis in Evaluating Behavior in Language Models? Evidence and Solutions.","2024","CoRR","Laurène Vaugrante, Mathias Niepert, Thilo Hagendorff","Informal and Other Publications","https://dblp.org/rec/journals/corr/abs-2409-20303","In an era where large language models (LLMs) are increasingly integrated into a wide range of everyday applications, research into these models' behavior has surged. However, due to the novelty of the field, clear methodological guidelines are lacking. This raises concerns about the replicability and generalizability of insights gained from research on LLM behavior. In this study, we discuss the potential risk of a replication crisis and support our concerns with a series of replication experiments focused on prompt engineering techniques purported to influence reasoning abilities in LLMs. We tested GPT-3.5, GPT-4o, Gemini 1.5 Pro, Claude 3 Opus, Llama 3-8B, and Llama 3-70B, on the chain-of-thought, EmotionPrompting, ExpertPrompting, Sandbagging, as well as Re-Reading prompt engineering techniques, using manually double-checked subsets of reasoning benchmarks including CommonsenseQA, CRT, NumGLUE, ScienceQA, and StrategyQA. Our findings reveal a general lack of statistically significant differences across nearly all techniques tested, highlighting, among others, several methodological weaknesses in previous research. We propose a forward-looking approach that includes developing robust methodologies for evaluating LLMs, establishing sound benchmarks, and designing rigorous experimental frameworks to ensure accurate and reliable assessments of model outputs."
"Accelerating Transformers with Spectrum-Preserving Token Merging.","2024","CoRR","Hoai-Chau Tran, Duy M. H. Nguyen, Duy M. Nguyen, TrungTin Nguyen, Ngan Le, Pengtao Xie, Daniel Sonntag, James Y. Zou, Binh T. Nguyen 0001, Mathias Niepert","Informal and Other Publications","https://dblp.org/rec/journals/corr/abs-2405-16148",""
"Active Learning for Neural PDE Solvers.","2024","CoRR","Daniel Musekamp, Marimuthu Kalimuthu, David Holzmüller, Makoto Takamoto, Mathias Niepert","Informal and Other Publications","https://dblp.org/rec/journals/corr/abs-2408-01536","&amp;lt;p&amp;gt;Running a high-resolution global climate model can take multiple days on the world's largest supercomputers. Due to the long runtimes that are caused by solving the underlying partial differential equations (PDEs), climate researchers struggle to generate ensemble runs that are necessary for uncertainty quantification or exploring climate policy decisions.&amp;lt;/p&amp;gt;&amp;lt;p&amp;gt;&amp;amp;#160;&amp;lt;/p&amp;gt;&amp;lt;p&amp;gt;Physics-informed neural networks (PINNs) promise a solution: they can solve single instances of PDEs up to three orders of magnitude faster than traditional finite difference numerical solvers. However, most approaches in physics-informed machine learning learn the solution of PDEs over the full spatio-temporal domain, which requires infeasible amounts of training data, does not exploit knowledge of the underlying large-scale physics, and reduces model trust. Our philosophy is to limit learning to the hard-to-model parts. Hence, we are proposing a novel method called \textit{matryoshka neural operator} that leverages an old scheme called super-parametrizations developed in geophysical fluid dynamics. Using this scheme our proposed physics-informed architecture exploits knowledge of approximate large-scale dynamics and only learns the influence of small-scale dynamics onto large-scale dynamics, also called subgrid parametrizations.&amp;lt;/p&amp;gt;&amp;lt;p&amp;gt;&amp;amp;#160;&amp;lt;/p&amp;gt;&amp;lt;p&amp;gt;Some work in geophysical fluid dynamics is conceptually similar, but fully relies on neural networks which can only operate on fixed grids (Gentine et al., 2018). We are the first to learn grid-independent subgrid parametrizations by leveraging neural operators that learn the dynamics in a grid-independent latent space. Neural operators can be seen as an extension of neural networks to infinite-dimensions: They encode infinite-dimensional inputs into a finite-dimensional representations, such as Eigen or Fourier modes, and learn the nonlinear temporal dynamics in the encoded state.&amp;lt;/p&amp;gt;&amp;lt;p&amp;gt;&amp;amp;#160;&amp;lt;/p&amp;gt;&amp;lt;p&amp;gt;We demonstrate the neural operators for learning non-local subgrid parametrizations over the full large-scale domain of the two-scale Lorenz96 equation. We show that the proposed learning-based PDE solver is grid-independent, has quasilinear instead of quadratic complexity in comparison to a fully-resolving numerical solver, is more accurate than current neural network or polynomial-based parametrizations, and offers interpretability through Fourier modes.&amp;lt;/p&amp;gt;&amp;lt;p&amp;gt;&amp;amp;#160;&amp;lt;/p&amp;gt;&amp;lt;p&amp;gt;Gentine, P., Pritchard, M., Rasp, S., Reinaudi, G., and Yacalis, G. (2018). Could machine learning break the convection parameterization deadlock? Geophysical Research Letters, 45, 5742&amp;amp;#8211; 5751. https://doi.org/10.1029/2018GL078202&amp;lt;/p&amp;gt;"
"Dude: Dual Distribution-Aware Context Prompt Learning For Large Vision-Language Model.","2024","CoRR","Duy M. H. Nguyen, An T. Le 0001, Trung Q. Nguyen, Nghiem T. Diep, Tai Nguyen 0008, Duy Duong-Tran, Jan Peters 0001, Li Shen 0001, Mathias Niepert, Daniel Sonntag","Informal and Other Publications","https://dblp.org/rec/journals/corr/abs-2407-04489","Prompt learning methods are gaining increasing attention due to their ability to customize large vision-language models to new domains using pre-trained contextual knowledge and minimal training data. However, existing works typically rely on optimizing unified prompt inputs, often struggling with fine-grained classification tasks due to insufficient discriminative attributes. To tackle this, we consider a new framework based on a dual context of both domain-shared and class-specific contexts, where the latter is generated by Large Language Models (LLMs) such as GPTs. Such dual prompt methods enhance the model's feature representation by joining implicit and explicit factors encoded in LLM knowledge. Moreover, we formulate the Unbalanced Optimal Transport (UOT) theory to quantify the relationships between constructed prompts and visual tokens. Through partial matching, UOT can properly align discrete sets of visual tokens and prompt embeddings under different mass distributions, which is particularly valuable for handling irrelevant or noisy elements, ensuring that the preservation of mass does not restrict transport solutions. Furthermore, UOT's characteristics integrate seamlessly with image augmentation, expanding the training sample pool while maintaining a reasonable distance between perturbed images and prompt inputs. Extensive experiments across few-shot classification and adapter settings substantiate the superiority of our model over current state-of-the-art baselines."
"Higher-Rank Irreducible Cartesian Tensors for Equivariant Message Passing.","2024","CoRR","Viktor Zaverkin, Francesco Alesiani, Takashi Maruyama, Federico Errica, Henrik Christiansen, Makoto Takamoto, Nicolas Weber, Mathias Niepert","Informal and Other Publications","https://dblp.org/rec/journals/corr/abs-2405-14253","The ability to perform fast and accurate atomistic simulations is crucial for advancing the chemical sciences. By learning from high-quality data, machine-learned interatomic potentials achieve accuracy on par with ab initio and first-principles methods at a fraction of their computational cost. The success of machine-learned interatomic potentials arises from integrating inductive biases such as equivariance to group actions on an atomic system, e.g., equivariance to rotations and reflections. In particular, the field has notably advanced with the emergence of equivariant message-passing architectures. Most of these models represent an atomic system using spherical tensors, tensor products of which require complicated numerical coefficients and can be computationally demanding. This work introduces higher-rank irreducible Cartesian tensors as an alternative to spherical tensors, addressing the above limitations. We integrate irreducible Cartesian tensor products into message-passing neural networks and prove the equivariance of the resulting layers. Through empirical evaluations on various benchmark data sets, we consistently observe on-par or better performance than that of state-of-the-art spherical models."
"Image Inpainting via Tractable Steering of Diffusion Models.","2024","ICLR","Anji Liu, Mathias Niepert, Guy Van den Broeck","Conference and Workshop Papers","https://dblp.org/rec/conf/iclr/LiuNB24","Diffusion models are the current state of the art for generating photorealistic images. Controlling the sampling process for constrained image generation tasks such as inpainting, however, remains challenging since exact conditioning on such constraints is intractable. While existing methods use various techniques to approximate the constrained posterior, this paper proposes to exploit the ability of Tractable Probabilistic Models (TPMs) to exactly and efficiently compute the constrained posterior, and to leverage this signal to steer the denoising process of diffusion models. Specifically, this paper adopts a class of expressive TPMs termed Probabilistic Circuits (PCs). Building upon prior advances, we further scale up PCs and make them capable of guiding the image generation process of diffusion models. Empirical results suggest that our approach can consistently improve the overall quality and semantic coherence of inpainted images across three natural image datasets (i.e., CelebA-HQ, ImageNet, and LSUN) with only ~10% additional computational overhead brought by the TPM. Further, with the help of an image encoder and decoder, our method can readily accept semantic constraints on specific regions of the image, which opens up the potential for more controlled image generation tasks. In addition to proposing a new framework for constrained image generation, this paper highlights the benefit of more tractable models and motivates the development of expressive TPMs."
"L2XGNN: learning to explain graph neural networks.","2024","Mach. Learn.","Giuseppe Serra 0002, Mathias Niepert","Journal Articles","https://dblp.org/rec/journals/ml/SerraN24","AbstractGraph Neural Networks (GNNs) are a popular class of machine learning models. Inspired by the learning to explain (L2X) paradigm, we propose L2xGnn, a framework for explainable GNNs which provides faithful explanations by design. L2xGnn learns a mechanism for selecting explanatory subgraphs (motifs) which are exclusively used in the GNNs message-passing operations. L2xGnn is able to select, for each input graph, a subgraph with specific properties such as being sparse and connected. Imposing such constraints on the motifs often leads to more interpretable and effective explanations. Experiments on several datasets suggest that L2xGnn achieves the same classification accuracy as baseline methods using the entire input graph while ensuring that only the provided explanations are used to make predictions. Moreover, we show that L2xGnn is able to identify motifs responsible for the graph’s properties it is intended to predict."
"Learning to Discretize Denoising Diffusion ODEs.","2024","CoRR","Vinh Tong, Anji Liu, Trung-Dung Hoang, Guy Van den Broeck, Mathias Niepert","Informal and Other Publications","https://dblp.org/rec/journals/corr/abs-2405-15506","Diffusion Probabilistic Models (DPMs) are generative models showing competitive performance in various domains, including image synthesis and 3D point cloud generation. Sampling from pre-trained DPMs involves multiple neural function evaluations (NFE) to transform Gaussian noise samples into images, resulting in higher computational costs compared to single-step generative models such as GANs or VAEs. Therefore, reducing the number of NFEs while preserving generation quality is crucial. To address this, we propose LD3, a lightweight framework designed to learn the optimal time discretization for sampling. LD3 can be combined with various samplers and consistently improves generation quality without having to retrain resource-intensive neural networks. We demonstrate analytically and empirically that LD3 improves sampling efficiency with much less computational overhead. We evaluate our method with extensive experiments on 7 pre-trained models, covering unconditional and conditional sampling in both pixel-space and latent-space DPMs. We achieve FIDs of 2.38 (10 NFE), and 2.27 (10 NFE) on unconditional CIFAR10 and AFHQv2 in 5-10 minutes of training. LD3 offers an efficient approach to sampling from pre-trained diffusion models. Code is available at https://github.com/vinhsuhi/LD3/tree/main."
"Physics-Informed Weakly Supervised Learning for Interatomic Potentials.","2024","CoRR","Makoto Takamoto, Viktor Zaverkin, Mathias Niepert","Informal and Other Publications","https://dblp.org/rec/journals/corr/abs-2408-05215","Abstract
        Efficiently creating a concise but comprehensive data set for training machine-learned interatomic potentials (MLIPs) is an under-explored problem. Active learning (AL), which uses either biased or unbiased molecular dynamics (MD) simulations to generate candidate pools, aims to address this objective. Existing biased and unbiased MD simulations, however, are prone to miss either rare events or extrapolative regions—areas of the configurational space where unreliable predictions are made. Simultaneously exploring both regions is necessary for developing uniformly accurate MLIPs. In this work, we demonstrate that MD simulations, when biased by the MLIP’s energy uncertainty, effectively capture extrapolative regions and rare events without the need to know a priori the system’s transition temperatures and pressures. Exploiting automatic differentiation, we enhance bias-forces-driven MD simulations by introducing the concept of bias stress. We also employ calibrated ensemble-free uncertainties derived from sketched gradient features to yield MLIPs with similar or better accuracy than ensemble-based uncertainty methods at a lower computational cost. We use the proposed uncertainty-driven AL approach to develop MLIPs for two benchmark systems: alanine dipeptide and MIL-53(Al). Compared to MLIPs trained with conventional MD simulations, MLIPs trained with the proposed data-generation method more accurately represent the relevant configurational space for both atomic systems."
"Probabilistic Graph Rewiring via Virtual Nodes.","2024","CoRR","Chendi Qian, Andrei Manolache, Christopher Morris 0001, Mathias Niepert","Informal and Other Publications","https://dblp.org/rec/journals/corr/abs-2405-17311","Message-passing graph neural networks (MPNNs) have emerged as a powerful paradigm for graph-based machine learning. Despite their effectiveness, MPNNs face challenges such as under-reaching and over-squashing, where limited receptive fields and structural bottlenecks hinder information flow in the graph. While graph transformers hold promise in addressing these issues, their scalability is limited due to quadratic complexity regarding the number of nodes, rendering them impractical for larger graphs. Here, we propose implicitly rewired message-passing neural networks (IPR-MPNNs), a novel approach that integrates implicit probabilistic graph rewiring into MPNNs. By introducing a small number of virtual nodes, i.e., adding additional nodes to a given graph and connecting them to existing nodes, in a differentiable, end-to-end manner, IPR-MPNNs enable long-distance message propagation, circumventing quadratic complexity. Theoretically, we demonstrate that IPR-MPNNs surpass the expressiveness of traditional MPNNs. Empirically, we validate our approach by showcasing its ability to mitigate under-reaching and over-squashing effects, achieving state-of-the-art performance across multiple graph datasets. Notably, IPR-MPNNs outperform graph transformers while maintaining significantly faster computational efficiency."
"Probabilistically Rewired Message-Passing Neural Networks.","2024","ICLR","Chendi Qian, Andrei Manolache, Kareem Ahmed, Zhe Zeng, Guy Van den Broeck, Mathias Niepert, Christopher Morris 0001","Conference and Workshop Papers","https://dblp.org/rec/conf/iclr/QianMAZBN024","Message-passing graph neural networks (MPNNs) emerged as powerful tools for processing graph-structured input. However, they operate on a fixed input graph structure, ignoring potential noise and missing information. Furthermore, their local aggregation mechanism can lead to problems such as over-squashing and limited expressive power in capturing relevant graph structures. Existing solutions to these challenges have primarily relied on heuristic methods, often disregarding the underlying data distribution. Hence, devising principled approaches for learning to infer graph structures relevant to the given prediction task remains an open challenge. In this work, leveraging recent progress in exact and differentiable $k$-subset sampling, we devise probabilistically rewired MPNNs (PR-MPNNs), which learn to add relevant edges while omitting less beneficial ones. For the first time, our theoretical analysis explores how PR-MPNNs enhance expressive power, and we identify precise conditions under which they outperform purely randomized approaches. Empirically, we demonstrate that our approach effectively mitigates issues like over-squashing and under-reaching. In addition, on established real-world datasets, our method exhibits competitive or superior predictive performance compared to traditional MPNN models and recent graph transformer architectures."
"Structure-Aware E(3)-Invariant Molecular Conformer Aggregation Networks.","2024","ICML","Duy Minh Ho Nguyen, Nina Lukashina, Tai Nguyen 0008, An T. Le 0001, TrungTin Nguyen, Nhat Ho, Jan Peters 0001, Daniel Sonntag, Viktor Zaverkin, Mathias Niepert","Conference and Workshop Papers","https://dblp.org/rec/conf/icml/NguyenL00NH0SZN24","A molecule's 2D representation consists of its atoms, their attributes, and the molecule's covalent bonds. A 3D (geometric) representation of a molecule is called a conformer and consists of its atom types and Cartesian coordinates. Every conformer has a potential energy, and the lower this energy, the more likely it occurs in nature. Most existing machine learning methods for molecular property prediction consider either 2D molecular graphs or 3D conformer structure representations in isolation. Inspired by recent work on using ensembles of conformers in conjunction with 2D graph representations, we propose $\mathrm{E}$(3)-invariant molecular conformer aggregation networks. The method integrates a molecule's 2D representation with that of multiple of its conformers. Contrary to prior work, we propose a novel 2D-3D aggregation mechanism based on a differentiable solver for the Fused Gromov-Wasserstein Barycenter problem and the use of an efficient conformer generation method based on distance geometry. We show that the proposed aggregation mechanism is $\mathrm{E}$(3) invariant and propose an efficient GPU implementation. Moreover, we demonstrate that the aggregation mechanism helps to significantly outperform state-of-the-art molecule property prediction methods on established datasets."
"Tractable Probabilistic Graph Representation Learning with Graph-Induced Sum-Product Networks.","2024","ICLR","Federico Errica, Mathias Niepert","Conference and Workshop Papers","https://dblp.org/rec/conf/iclr/ErricaN24","We introduce Graph-Induced Sum-Product Networks (GSPNs), a new probabilistic framework for graph representation learning that can tractably answer probabilistic queries. Inspired by the computational trees induced by vertices in the context of message-passing neural networks, we build hierarchies of sum-product networks (SPNs) where the parameters of a parent SPN are learnable transformations of the a-posterior mixing probabilities of its children's sum units. Due to weight sharing and the tree-shaped computation graphs of GSPNs, we obtain the efficiency and efficacy of deep graph networks with the additional advantages of a probabilistic model. We show the model's competitiveness on scarce supervision scenarios, under missing data, and for graph classification in comparison to popular neural models. We complement the experiments with qualitative analyses on hyper-parameters and the model's ability to answer probabilistic queries."
"Vectorized Conditional Neural Fields: A Framework for Solving Time-dependent Parametric Partial Differential Equations.","2024","ICML","Jan Hagnberger, Marimuthu Kalimuthu, Daniel Musekamp, Mathias Niepert","Conference and Workshop Papers","https://dblp.org/rec/conf/icml/HagnbergerKMN24","Transformer models are increasingly used for solving Partial Differential Equations (PDEs). Several adaptations have been proposed, all of which suffer from the typical problems of Transformers, such as quadratic memory and time complexity. Furthermore, all prevalent architectures for PDE solving lack at least one of several desirable properties of an ideal surrogate model, such as (i) generalization to PDE parameters not seen during training, (ii) spatial and temporal zero-shot super-resolution, (iii) continuous temporal extrapolation, (iv) support for 1D, 2D, and 3D PDEs, and (v) efficient inference for longer temporal rollouts. To address these limitations, we propose Vectorized Conditional Neural Fields (VCNeFs), which represent the solution of time-dependent PDEs as neural fields. Contrary to prior methods, however, VCNeFs compute, for a set of multiple spatio-temporal query points, their solutions in parallel and model their dependencies through attention mechanisms. Moreover, VCNeF can condition the neural field on both the initial conditions and the parameters of the PDEs. An extensive set of experiments demonstrates that VCNeFs are competitive with and often outperform existing ML-based surrogate models."
"Adaptive Perturbation-Based Gradient Estimation for Discrete Latent Variable Models.","2023","AAAI","Pasquale Minervini, Luca Franceschi 0001, Mathias Niepert","Conference and Workshop Papers","https://dblp.org/rec/conf/aaai/Minervini0N23","The integration of discrete algorithmic components in deep learning architectures has numerous applications. Recently, Implicit Maximum Likelihood Estimation, a class of gradient estimators for discrete exponential family distributions, was proposed by combining implicit differentiation through perturbation with the path-wise gradient estimator. However, due to the finite difference approximation of the gradients, it is especially sensitive to the choice of the finite difference step size, which needs to be specified by the user. In this work, we present Adaptive IMLE (AIMLE), the first adaptive gradient estimator for complex discrete distributions: it adaptively identifies the target distribution for IMLE by trading off the density of gradient information with the degree of bias in the gradient estimates. We empirically evaluate our estimator on synthetic examples, as well as on Learning to Explain, Discrete Variational Auto-Encoders, and Neural Relational Inference tasks. In our experiments, we show that our adaptive gradient estimator can produce faithful estimates while requiring orders of magnitude fewer samples than other gradient estimators."
"LVM-Med: Learning Large-Scale Self-Supervised Vision Models for Medical Imaging via Second-order Graph Matching.","2023","NeurIPS","Duy M. H. Nguyen, Hoang Nguyen, Nghiem Tuong Diep, Tan Ngoc Pham, Tri Cao, Binh T. Nguyen 0001, Paul Swoboda, Nhat Ho, Shadi Albarqouni, Pengtao Xie, Daniel Sonntag, Mathias Niepert","Conference and Workshop Papers","https://dblp.org/rec/conf/nips/NguyenNDPC0SHAX23","Obtaining large pre-trained models that can be fine-tuned to new tasks with limited annotated samples has remained an open challenge for medical imaging data. While pre-trained deep networks on ImageNet and vision-language foundation models trained on web-scale data are prevailing approaches, their effectiveness on medical tasks is limited due to the significant domain shift between natural and medical images. To bridge this gap, we introduce LVM-Med, the first family of deep networks trained on large-scale medical datasets. We have collected approximately 1.3 million medical images from 55 publicly available datasets, covering a large number of organs and modalities such as CT, MRI, X-ray, and Ultrasound. We benchmark several state-of-the-art self-supervised algorithms on this dataset and propose a novel self-supervised contrastive learning algorithm using a graph-matching formulation. The proposed approach makes three contributions: (i) it integrates prior pair-wise image similarity metrics based on local and global information; (ii) it captures the structural constraints of feature embeddings through a loss function constructed via a combinatorial graph-matching objective; and (iii) it can be trained efficiently end-to-end using modern gradient-estimation techniques for black-box solvers. We thoroughly evaluate the proposed LVM-Med on 15 downstream medical tasks ranging from segmentation and classification to object detection, and both for the in and out-of-distribution settings. LVM-Med empirically outperforms a number of state-of-the-art supervised, self-supervised, and foundation models. For challenging tasks such as Brain Tumor Classification or Diabetic Retinopathy Grading, LVM-Med improves previous vision-language models trained on 1 billion masks by 6-7% while using only a ResNet-50."
