"title","year","venue","authors","type","url","abstract"
"An Interventional Perspective on Identifiability in Gaussian LTI Systems with Independent Component Analysis.","2024","CLeaR","Goutham Rajendran, Patrik Reizinger, Wieland Brendel, Pradeep Kumar Ravikumar","Conference and Workshop Papers","https://dblp.org/rec/conf/clear2/RajendranRBR24","We investigate the relationship between system identification and intervention design in dynamical systems. While previous research demonstrated how identifiable representation learning methods, such as Independent Component Analysis (ICA), can reveal cause-effect relationships, it relied on a passive perspective without considering how to collect data. Our work shows that in Gaussian Linear Time-Invariant (LTI) systems, the system parameters can be identified by introducing diverse intervention signals in a multi-environment setting. By harnessing appropriate diversity assumptions motivated by the ICA literature, our findings connect experiment design and representational identifiability in dynamical systems. We corroborate our findings on synthetic and (simulated) physical data. Additionally, we show that Hidden Markov Models, in general, and (Gaussian) LTI systems, in particular, fulfil a generalization of the Causal de Finetti theorem with continuous parameters."
"Does CLIP's generalization performance mainly stem from high train-test similarity?","2024","ICLR","Prasanna Mayilvahanan, Thaddäus Wiedemer, Evgenia Rusak, Matthias Bethge, Wieland Brendel","Conference and Workshop Papers","https://dblp.org/rec/conf/iclr/MayilvahananWRB24","Foundation models like CLIP are trained on hundreds of millions of samples and effortlessly generalize to new tasks and inputs. Out of the box, CLIP shows stellar zero-shot and few-shot capabilities on a wide range of out-of-distribution (OOD) benchmarks, which prior works attribute mainly to today's large and comprehensive training dataset (like LAION). However, it is questionable how meaningful terms like out-of-distribution generalization are for CLIP as it seems likely that web-scale datasets like LAION simply contain many samples that are similar to common OOD benchmarks originally designed for ImageNet. To test this hypothesis, we retrain CLIP on pruned LAION splits that replicate ImageNet's train-test similarity with respect to common OOD benchmarks. While we observe a performance drop on some benchmarks, surprisingly, CLIP's overall performance remains high. This shows that high train-test similarity is insufficient to explain CLIP's OOD performance, and other properties of the training data must drive CLIP to learn more generalizable representations. Additionally, by pruning data points that are dissimilar to the OOD benchmarks, we uncover a 100M split of LAION ($\frac{1}{4}$th of its original size) on which CLIP can be trained to match its original OOD performance."
"Don't trust your eyes: on the (un)reliability of feature visualizations.","2024","ICML","Robert Geirhos, Roland S. Zimmermann, Blair L. Bilodeau, Wieland Brendel, Been Kim","Conference and Workshop Papers","https://dblp.org/rec/conf/icml/GeirhosZBBK24","How do neural networks extract patterns from pixels? Feature visualizations attempt to answer this important question by visualizing highly activating patterns through optimization. Today, visualization methods form the foundation of our knowledge about the internal workings of neural networks, as a type of mechanistic interpretability. Here we ask: How reliable are feature visualizations? We start our investigation by developing network circuits that trick feature visualizations into showing arbitrary patterns that are completely disconnected from normal network behavior on natural input. We then provide evidence for a similar phenomenon occurring in standard, unmanipulated networks: feature visualizations are processed very differently from standard input, casting doubt on their ability to""explain""how neural networks process natural images. This can be used as a sanity check for feature visualizations. We underpin our empirical findings by theory proving that the set of functions that can be reliably understood by feature visualization is extremely small and does not include general black-box neural networks. Therefore, a promising way forward could be the development of networks that enforce certain structures in order to ensure more reliable feature visualizations."
"Effective pruning of web-scale datasets based on complexity of concept clusters.","2024","ICLR","Amro Abbas, Evgenia Rusak, Kushal Tirumala, Wieland Brendel, Kamalika Chaudhuri, Ari S. Morcos","Conference and Workshop Papers","https://dblp.org/rec/conf/iclr/AbbasRTBCM24","Utilizing massive web-scale datasets has led to unprecedented performance gains in machine learning models, but also imposes outlandish compute requirements for their training. In order to improve training and data efficiency, we here push the limits of pruning large-scale multimodal datasets for training CLIP-style models. Today's most effective pruning method on ImageNet clusters data samples into separate concepts according to their embedding and prunes away the most prototypical samples. We scale this approach to LAION and improve it by noting that the pruning rate should be concept-specific and adapted to the complexity of the concept. Using a simple and intuitive complexity measure, we are able to reduce the training cost to a quarter of regular training. By filtering from the LAION dataset, we find that training on a smaller set of high-quality data can lead to higher performance with significantly lower training costs. More specifically, we are able to outperform the LAION-trained OpenCLIP-ViT-B32 model on ImageNet zero-shot accuracy by 1.1p.p. while only using 27.7% of the data and training compute. Despite a strong reduction in training cost, we also see improvements on ImageNet dist. shifts, retrieval tasks and VTAB. On the DataComp Medium benchmark, we achieve a new state-of-the-art Imagehttps://info.arxiv.org/help/prep#commentsNet zero-shot accuracy and a competitive average zero-shot accuracy on 38 evaluation tasks."
"Identifiable Exchangeable Mechanisms for Causal Structure and Representation Learning.","2024","CoRR","Patrik Reizinger, Siyuan Guo, Ferenc Huszár, Bernhard Schölkopf, Wieland Brendel","Informal and Other Publications","https://dblp.org/rec/journals/corr/abs-2406-14302","Identifying latent representations or causal structures is important for good generalization and downstream task performance. However, both fields have been developed rather independently. We observe that several methods in both representation and causal structure learning rely on the same data-generating process (DGP), namely, exchangeable but not i.i.d. (independent and identically distributed) data. We provide a unified framework, termed Identifiable Exchangeable Mechanisms (IEM), for representation and structure learning under the lens of exchangeability. IEM provides new insights that let us relax the necessary conditions for causal structure identification in exchangeable non--i.i.d. data. We also demonstrate the existence of a duality condition in identifiable representation learning, leading to new identifiability results. We hope this work will pave the way for further research in causal representation learning."
"InfoNCE: Identifying the Gap Between Theory and Practice.","2024","CoRR","Evgenia Rusak, Patrik Reizinger, Attila Juhos, Oliver Bringmann 0001, Roland S. Zimmermann, Wieland Brendel","Informal and Other Publications","https://dblp.org/rec/journals/corr/abs-2407-00143","Previous theoretical work on contrastive learning (CL) with InfoNCE showed that, under certain assumptions, the learned representations uncover the ground-truth latent factors. We argue these theories overlook crucial aspects of how CL is deployed in practice. Specifically, they assume that within a positive pair, all latent factors either vary to a similar extent, or that some do not vary at all. However, in practice, positive pairs are often generated using augmentations such as strong cropping to just a few pixels. Hence, a more realistic assumption is that all latent factors change, with a continuum of variability across these factors. We introduce AnInfoNCE, a generalization of InfoNCE that can provably uncover the latent factors in this anisotropic setting, broadly generalizing previous identifiability results in CL. We validate our identifiability results in controlled experiments and show that AnInfoNCE increases the recovery of previously collapsed information in CIFAR10 and ImageNet, albeit at the cost of downstream accuracy. Additionally, we explore and discuss further mismatches between theoretical assumptions and practical implementations, including extensions to hard negative mining and loss ensembles."
"Position: Understanding LLMs Requires More Than Statistical Generalization.","2024","ICML","Patrik Reizinger, Szilvia Ujváry, Anna Mészáros, Anna Kerekes, Wieland Brendel, Ferenc Huszár","Conference and Workshop Papers","https://dblp.org/rec/conf/icml/ReizingerUMKBH24","The last decade has seen blossoming research in deep learning theory attempting to answer,""Why does deep learning generalize?""A powerful shift in perspective precipitated this progress: the study of overparametrized models in the interpolation regime. In this paper, we argue that another perspective shift is due, since some of the desirable qualities of LLMs are not a consequence of good statistical generalization and require a separate theoretical explanation. Our core argument relies on the observation that AR probabilistic models are inherently non-identifiable: models zero or near-zero KL divergence apart -- thus, equivalent test loss -- can exhibit markedly different behaviors. We support our position with mathematical examples and empirical observations, illustrating why non-identifiability has practical relevance through three case studies: (1) the non-identifiability of zero-shot rule extrapolation; (2) the approximate non-identifiability of in-context learning; and (3) the non-identifiability of fine-tunability. We review promising research directions focusing on LLM-relevant generalization measures, transferability, and inductive biases."
"Provable Compositional Generalization for Object-Centric Learning.","2024","ICLR","Thaddäus Wiedemer, Jack Brady, Alexander Panfilov, Attila Juhos, Matthias Bethge, Wieland Brendel","Conference and Workshop Papers","https://dblp.org/rec/conf/iclr/WiedemerBPJBB24","Learning representations that generalize to novel compositions of known concepts is crucial for bridging the gap between human and machine perception. One prominent effort is learning object-centric representations, which are widely conjectured to enable compositional generalization. Yet, it remains unclear when this conjecture will be true, as a principled theoretical or empirical understanding of compositional generalization is lacking. In this work, we investigate when compositional generalization is guaranteed for object-centric representations through the lens of identifiability theory. We show that autoencoders that satisfy structural assumptions on the decoder and enforce encoder-decoder consistency will learn object-centric representations that provably generalize compositionally. We validate our theoretical result and highlight the practical relevance of our assumptions through experiments on synthetic image data."
"Rule Extrapolation in Language Models: A Study of Compositional Generalization on OOD Prompts.","2024","CoRR","Anna Mészáros, Szilvia Ujváry, Wieland Brendel, Patrik Reizinger, Ferenc Huszár","Informal and Other Publications","https://dblp.org/rec/journals/corr/abs-2409-13728","LLMs show remarkable emergent abilities, such as inferring concepts from presumably out-of-distribution prompts, known as in-context learning. Though this success is often attributed to the Transformer architecture, our systematic understanding is limited. In complex real-world data sets, even defining what is out-of-distribution is not obvious. To better understand the OOD behaviour of autoregressive LLMs, we focus on formal languages, which are defined by the intersection of rules. We define a new scenario of OOD compositional generalization, termed rule extrapolation. Rule extrapolation describes OOD scenarios, where the prompt violates at least one rule. We evaluate rule extrapolation in formal languages with varying complexity in linear and recurrent architectures, the Transformer, and state space models to understand the architectures' influence on rule extrapolation. We also lay the first stones of a normative theory of rule extrapolation, inspired by the Solomonoff prior in algorithmic information theory."
"Translational symmetry in convolutions with localized kernels causes an implicit bias toward high frequency adversarial examples.","2024","Frontiers Comput. Neurosci.","Josue Ortega Caro, Yilong Ju, Ryan Pyle, Sourav Dey, Wieland Brendel, Fabio Anselmi, Ankit B. Patel","Journal Articles","https://dblp.org/rec/journals/ficn/CaroJPDBAP24","Adversarial attacks are still a significant challenge for neural networks. Recent efforts have shown that adversarial perturbations typically contain high-frequency features, but the root cause of this phenomenon remains unknown. Inspired by theoretical work on linear convolutional models, we hypothesize that translational symmetry in convolutional operations together with localized kernels implicitly bias the learning of high-frequency features, and that this is one of the main causes of high frequency adversarial examples. To test this hypothesis, we analyzed the impact of different choices of linear and non-linear architectures on the implicit bias of the learned features and adversarial perturbations, in spatial and frequency domains. We find that, independently of the training dataset, convolutional operations have higher frequency adversarial attacks compared to other architectural parameterizations, and that this phenomenon is exacerbated with stronger locality of the kernel (kernel size) end depth of the model. The explanation for the kernel size dependence involves the Fourier Uncertainty Principle: a spatially-limited filter (local kernel in the space domain) cannot also be frequency-limited (local in the frequency domain). Using larger convolution kernel sizes or avoiding convolutions (e.g., by using Vision Transformers or MLP-style architectures) significantly reduces this high-frequency bias. Looking forward, our work strongly suggests that understanding and controlling the implicit bias of architectures will be essential for achieving adversarial robustness."
"Understanding LLMs Requires More Than Statistical Generalization.","2024","CoRR","Patrik Reizinger, Szilvia Ujváry, Anna Mészáros, Anna Kerekes, Wieland Brendel, Ferenc Huszár","Informal and Other Publications","https://dblp.org/rec/journals/corr/abs-2405-01964","The last decade has seen blossoming research in deep learning theory attempting to answer,""Why does deep learning generalize?""A powerful shift in perspective precipitated this progress: the study of overparametrized models in the interpolation regime. In this paper, we argue that another perspective shift is due, since some of the desirable qualities of LLMs are not a consequence of good statistical generalization and require a separate theoretical explanation. Our core argument relies on the observation that AR probabilistic models are inherently non-identifiable: models zero or near-zero KL divergence apart -- thus, equivalent test loss -- can exhibit markedly different behaviors. We support our position with mathematical examples and empirical observations, illustrating why non-identifiability has practical relevance through three case studies: (1) the non-identifiability of zero-shot rule extrapolation; (2) the approximate non-identifiability of in-context learning; and (3) the non-identifiability of fine-tunability. We review promising research directions focusing on LLM-relevant generalization measures, transferability, and inductive biases."
"Compositional Generalization from First Principles.","2023","NeurIPS","Thaddäus Wiedemer, Prasanna Mayilvahanan, Matthias Bethge, Wieland Brendel","Conference and Workshop Papers","https://dblp.org/rec/conf/nips/WiedemerMBB23","Abstract
          
            The recently formulated
            Shadow Semantics
            for noninterference-style security of sequential programs avoids the Refinement Paradox by preserving demonic nondeterminism in those cases where reducing it would compromise security. The construction (originally) of the semantic domain for
            The Shadow
            , and the interpretation of programs in it, relied heavily on intuition, guesswork and the advice of others. That being so, it is natural after the fact to try to reconstruct an idealised “inevitable” path from first principles to where we actually ended up: not only does one learn (more) about semantic principles by doing so, but the “rational reconstruction” helps to expose the choices made, along the way, and to legitimise the decisions that resolved them. Unlike our other papers on noninterference, this one does not contain a significant case study: instead its aim is to provide the most accessible account we can of the methods we use and why our model, in its details, has turned out the way it has. In passing, it might give some insight into the general role and significance of compositionality and testing-with-context for program semantics. Finally, a technical contribution here is a new “Transfer Principle” that captures uniformly a large class of classical refinements that remain valid when noninterference is taken into account in our style."
"Don't trust your eyes: on the (un)reliability of feature visualizations.","2023","CoRR","Robert Geirhos, Roland S. Zimmermann, Blair L. Bilodeau, Wieland Brendel, Been Kim","Informal and Other Publications","https://dblp.org/rec/journals/corr/abs-2306-04719","How do neural networks extract patterns from pixels? Feature visualizations attempt to answer this important question by visualizing highly activating patterns through optimization. Today, visualization methods form the foundation of our knowledge about the internal workings of neural networks, as a type of mechanistic interpretability. Here we ask: How reliable are feature visualizations? We start our investigation by developing network circuits that trick feature visualizations into showing arbitrary patterns that are completely disconnected from normal network behavior on natural input. We then provide evidence for a similar phenomenon occurring in standard, unmanipulated networks: feature visualizations are processed very differently from standard input, casting doubt on their ability to""explain""how neural networks process natural images. This can be used as a sanity check for feature visualizations. We underpin our empirical findings by theory proving that the set of functions that can be reliably understood by feature visualization is extremely small and does not include general black-box neural networks. Therefore, a promising way forward could be the development of networks that enforce certain structures in order to ensure more reliable feature visualizations."
"Iterative weakly supervised learning for novel class object detection.","2023","Tiny Papers @ ICLR","Dejana Mandic, Wieland Brendel, Claudio Michaelis","Conference and Workshop Papers","https://dblp.org/rec/conf/iclr/MandicBM23",""
"Jacobian-based Causal Discovery with Nonlinear ICA.","2023","Trans. Mach. Learn. Res.","Patrik Reizinger, Yash Sharma 0001, Matthias Bethge, Bernhard Schölkopf, Ferenc Huszár, Wieland Brendel","Journal Articles","https://dblp.org/rec/journals/tmlr/ReizingerSBSHB23","Today’s methods for uncovering causal relationships from observational data either constrain functional assignments (linearity/additive noise assumptions) or the data generating process (e"
"Provable Compositional Generalization for Object-Centric Learning.","2023","CoRR","Thaddäus Wiedemer, Jack Brady, Alexander Panfilov, Attila Juhos, Matthias Bethge, Wieland Brendel","Informal and Other Publications","https://dblp.org/rec/journals/corr/abs-2310-05327","Learning representations that generalize to novel compositions of known concepts is crucial for bridging the gap between human and machine perception. One prominent effort is learning object-centric representations, which are widely conjectured to enable compositional generalization. Yet, it remains unclear when this conjecture will be true, as a principled theoretical or empirical understanding of compositional generalization is lacking. In this work, we investigate when compositional generalization is guaranteed for object-centric representations through the lens of identifiability theory. We show that autoencoders that satisfy structural assumptions on the decoder and enforce encoder-decoder consistency will learn object-centric representations that provably generalize compositionally. We validate our theoretical result and highlight the practical relevance of our assumptions through experiments on synthetic image data."
"Provably Learning Object-Centric Representations.","2023","ICML","Jack Brady, Roland S. Zimmermann, Yash Sharma 0001, Bernhard Schölkopf, Julius von Kügelgen, Wieland Brendel","Conference and Workshop Papers","https://dblp.org/rec/conf/icml/BradyZ0SKB23","Learning structured representations of the visual world in terms of objects promises to significantly improve the generalization abilities of current machine learning models. While recent efforts to this end have shown promising empirical progress, a theoretical account of when unsupervised object-centric representation learning is possible is still lacking. Consequently, understanding the reasons for the success of existing object-centric methods as well as designing new theoretically grounded methods remains challenging. In the present work, we analyze when object-centric representations can provably be learned without supervision. To this end, we first introduce two assumptions on the generative process for scenes comprised of several objects, which we call compositionality and irreducibility. Under this generative process, we prove that the ground-truth object representations can be identified by an invertible and compositional inference model, even in the presence of dependencies between objects. We empirically validate our results through experiments on synthetic data. Finally, we provide evidence that our theory holds predictive power for existing object-centric models by showing a close correspondence between models' compositionality and invertibility and their empirical identifiability."
"Robust deep learning object recognition models rely on low frequency information in natural images.","2023","PLoS Comput. Biol.","Zhe Li 0002, Josue Ortega Caro, Evgenia Rusak, Wieland Brendel, Matthias Bethge, Fabio Anselmi, Ankit B. Patel, Andreas S. Tolias, Xaq Pitkow","Journal Articles","https://dblp.org/rec/journals/ploscb/LiCRBBAPTP23","Machine learning models have difficulty generalizing to data outside of the distribution they were trained on. In particular, vision models are usually vulnerable to adversarial attacks or common corruptions, to which the human visual system is robust. Recent studies have found that regularizing machine learning models to favor brain-like representations can improve model robustness, but it is unclear why. We hypothesize that the increased model robustness is partly due to the low spatial frequency preference inherited from the neural representation. We tested this simple hypothesis with several frequency-oriented analyses, including the design and use of hybrid images to probe model frequency sensitivity directly. We also examined many other publicly available robust models that were trained on adversarial images or with data augmentation, and found that all these robust models showed a greater preference to low spatial frequency information. We show that preprocessing by blurring can serve as a defense mechanism against both adversarial attacks and common corruptions, further confirming our hypothesis and demonstrating the utility of low spatial frequency information in robust object recognition."
