"title","year","venue","authors","type","url","abstract"
"Grounding Everything: Emerging Localization Properties in Vision-Language Transformers.","2023","CoRR","Walid Bousselham, Felix Petersen, Vittorio Ferrari, Hilde Kuehne","Informal and Other Publications","https://dblp.org/rec/journals/corr/abs-2312-00878","Vision-language foundation models have shown remark-able performance in various zero-shot settings such as im-age retrieval, classification, or captioning. But so far, those models seem to fall behind when it comes to zero-shot lo-calization of referential expressions and objects in images. As a result, they need to be fine-tuned for this task. In this paper, we show that pretrained vision-language (VL) models allow for zero-shot open-vocabulary object local-ization without any fine-tuning. To leverage those capabil-ities, we propose a Grounding Everything Module (GEM) that generalizes the idea of value-value attention introduced by CLIPSurgery [17] to a self-self attention path. We show that the concept of self-self attention corresponds to clustering, thus enforcing groups of tokens arising from the same object to be similar while preserving the alignment with the language space. To further guide the group formation, we propose a set of regularizations that allows the model to finally generalize across datasets and backbones. We evaluate the proposed GEM framework on various bench-mark tasks and datasets for semantic segmentation. GEM not only outperforms other training-free open-vocabulary localization methods, but also achieves state-of-the-art re-sults on the recently proposed OpenImagesV7 large-scale segmentation benchmark.111 Code is available at https://github.com/WalBouss/GEM."
"HowToCaption: Prompting LLMs to Transform Video Annotations at Scale.","2023","CoRR","Nina Shvetsova, Anna Kukleva, Xudong Hong 0002, Christian Rupprecht 0001, Bernt Schiele, Hilde Kuehne","Informal and Other Publications","https://dblp.org/rec/journals/corr/abs-2310-04900","Instructional videos are a common source for learning text-video or even multimodal representations by leveraging subtitles extracted with automatic speech recognition systems (ASR) from the audio signal in the videos. However, in contrast to human-annotated captions, both speech and subtitles naturally differ from the visual content of the videos and thus provide only noisy supervision. As a result, large-scale annotation-free web video training data remains sub-optimal for training text-video models. In this work, we propose to leverage the capabilities of large language models (LLMs) to obtain high-quality video descriptions aligned with videos at scale. Specifically, we prompt an LLM to create plausible video captions based on ASR subtitles of instructional videos. To this end, we introduce a prompting method that is able to take into account a longer text of subtitles, allowing us to capture the contextual information beyond one single sentence. We further prompt the LLM to generate timestamps for each produced caption based on the timestamps of the subtitles and finally align the generated captions to the video temporally. In this way, we obtain human-style video captions at scale without human supervision. We apply our method to the subtitles of the HowTo100M dataset, creating a new large-scale dataset, HowToCaption. Our evaluation shows that the resulting captions not only significantly improve the performance over many different benchmark datasets for zero-shot text-video retrieval and video captioning, but also lead to a disentangling of textual narration from the audio, boosting the performance in text-video-audio tasks."
"Learning Human Action Recognition Representations Without Real Humans.","2023","NeurIPS","Howard Zhong, Samarth Mishra, Donghyun Kim 0006, SouYoung Jin, Rameswar Panda, Hilde Kuehne, Leonid Karlinsky, Venkatesh Saligrama, Aude Oliva, Rogério Feris","Conference and Workshop Papers","https://dblp.org/rec/conf/nips/ZhongMKJPKKSOF23","Pre-training on massive video datasets has become essential to achieve high action recognition performance on smaller downstream datasets. However, most large-scale video datasets contain images of people and hence are accompanied with issues related to privacy, ethics, and data protection, often preventing them from being publicly shared for reproducible research. Existing work has attempted to alleviate these problems by blurring faces, downsampling videos, or training on synthetic data. On the other hand, analysis on the transferability of privacy-preserving pre-trained models to downstream tasks has been limited. In this work, we study this problem by first asking the question: can we pre-train models for human action recognition with data that does not include real humans? To this end, we present, for the first time, a benchmark that leverages real-world videos with humans removed and synthetic data containing virtual humans to pre-train a model. We then evaluate the transferability of the representation learned on this data to a diverse set of downstream action recognition benchmarks. Furthermore, we propose a novel pre-training strategy, called Privacy-Preserving MAE-Align, to effectively combine synthetic data and human-removed real data. Our approach outperforms previous baselines by up to 5% and closes the performance gap between human and no-human action recognition representations on downstream tasks, for both linear probing and fine-tuning. Our benchmark, code, and models are available at https://github.com/howardzh01/PPMA ."
"WEAR: A Multimodal Dataset for Wearable and Egocentric Video Activity Recognition.","2023","CoRR","Marius Bock, Michael Moeller 0001, Kristof Van Laerhoven, Hilde Kuehne","Informal and Other Publications","https://dblp.org/rec/journals/corr/abs-2304-05088","Though research has shown the complementarity of camera-and inertial-based data, datasets which offer both modalities remain scarce. In this paper we introduce WEAR, a multimodal benchmark dataset for both vision-and wearable-based Human Activity Recognition (HAR). The dataset comprises data from 18 participants performing a total of 18 different workout activities with untrimmed inertial (acceleration) and camera (egocentric video) data recorded at 10 different outside locations. WEAR features a diverse set of activities which are low in inter-class similarity and, unlike previous egocentric datasets, not deﬁned by human-object-interactions nor originate from inherently distinct activity categories. Provided benchmark re-sults reveal that single-modality architectures have different strengths and weaknesses in their prediction performance. Further, in light of the recent success of transformer-based video action detection models, we demonstrate their versatility by applying them in a plain fashion using vision, inertial and combined (vision + inertial) features as input. Results show that vision transformers are not only able to produce competitive results using only inertial data, but also can function as an architecture to fuse both modalities by means of simple concatenation, with the multi-modal approach being able to produce the highest average mAP, precision and close-to-best F1-scores. Up until now, vision-based transformers have neither been explored in inertial nor in multimodal human activity recognition, making our approach the ﬁrst to do so. The dataset and code to reproduce experiments is publicly available via:"
"What a MESS: Multi-Domain Evaluation of Zero-Shot Semantic Segmentation.","2023","NeurIPS","Benedikt Blumenstiel, Johannes Jakubik, Hilde Kühne, Michael Vössing","Conference and Workshop Papers","https://dblp.org/rec/conf/nips/BlumenstielJKV23","While semantic segmentation has seen tremendous improvements in the past, there are still significant labeling efforts necessary and the problem of limited generalization to classes that have not been present during training. To address this problem, zero-shot semantic segmentation makes use of large self-supervised vision-language models, allowing zero-shot transfer to unseen classes. In this work, we build a benchmark for Multi-domain Evaluation of Semantic Segmentation (MESS), which allows a holistic analysis of performance across a wide range of domain-specific datasets such as medicine, engineering, earth monitoring, biology, and agriculture. To do this, we reviewed 120 datasets, developed a taxonomy, and classified the datasets according to the developed taxonomy. We select a representative subset consisting of 22 datasets and propose it as the MESS benchmark. We evaluate eight recently published models on the proposed MESS benchmark and analyze characteristics for the performance of zero-shot transfer models. The toolkit is available at https://github.com/blumenstiel/MESS."
"What, when, and where? - Self-Supervised Spatio-Temporal Grounding in Untrimmed Multi-Action Videos from Narrated Instructions.","2023","CoRR","Brian Chen 0001, Nina Shvetsova, Andrew Rouditchenko, Daniel Kondermann, Samuel Thomas 0001, Shih-Fu Chang, Rogério Feris, James R. Glass, Hilde Kuehne","Informal and Other Publications","https://dblp.org/rec/journals/corr/abs-2303-16990","Spatio-temporal grounding describes the task of localizing events in space and time, e.g., in video data, based on verbal descriptions only. Models for this task are usually trained with human-annotated sentences and bounding box supervision. This work addresses this task from a multimodal supervision perspective, proposing a framework for spatio-temporal action grounding trained on loose video and subtitle supervision only, without human annotation. To this end, we combine local representation learning, which focuses on leveraging fine-grained spatial information, with a global representation encoding that captures higher-level representations and incorporates both in a joint approach. To evaluate this challenging task in a real-life setting, a new benchmark dataset is proposed, providing dense spatio-temporal grounding annotations in long, untrimmed, multi-action instructional videos for over 5K events. We evaluate the proposed approach and other methods on the proposed and standard downstream tasks, showing that our method improves over current baselines in various settings, including spatial, temporal, and untrimmed multi-action spatio-temporal grounding."
