"title","year","venue","authors","type","url","abstract"
"HDHumans: A Hybrid Approach for High-fidelity Digital Humans.","2023","Proc. ACM Comput. Graph. Interact. Tech.","Marc Habermann, Lingjie Liu, Weipeng Xu, Gerard Pons-Moll, Michael Zollhöfer, Christian Theobalt","Journal Articles","https://dblp.org/rec/journals/pacmcgit/HabermannLXPZT23","Photo-real digital human avatars are of enormous importance in graphics, as they enable immersive communication over the globe, improve gaming and entertainment experiences, and can be particularly beneficial for AR and VR settings. However, current avatar generation approaches either fall short in high-fidelity novel view synthesis, generalization to novel motions, reproduction of loose clothing, or they cannot render characters at the high resolution offered by modern displays. To this end, we propose HDHumans, which is the first method for HD human character synthesis that jointly produces an accurate and temporally coherent 3D deforming surface and highly photo-realistic images of arbitrary novel views and of motions not seen at training time. At the technical core, our method tightly integrates a classical deforming character template with neural radiance fields (NeRF). Our method is carefully designed to achieve a synergy between classical surface deformation and a NeRF. First, the template guides the NeRF, which allows synthesizing novel views of a highly dynamic and articulated character and even enables the synthesis of novel motions. Second, we also leverage the dense pointclouds resulting from the NeRF to further improve the deforming surface via 3D-to-3D supervision. We outperform the state of the art quantitatively and qualitatively in terms of synthesis quality and resolution, as well as the quality of 3D surface reconstruction."
"Control-NeRF: Editable Feature Volumes for Scene Rendering and Manipulation.","2023","WACV","Verica Lazova, Vladimir Guzov, Kyle Olszewski, Sergey Tulyakov, Gerard Pons-Moll","Conference and Workshop Papers","https://dblp.org/rec/conf/wacv/LazovaGOTP23","We present Control-NeRF1, a method for performing flexible, 3D-aware image content manipulation while enabling high-quality novel view synthesis, from a set of posed input images. NeRF-based approaches [23] are effective for novel view synthesis, however such models memorize the radiance for every point in a scene within a neural network. Since these models are scene-specific and lack a 3D scene representation, classical editing such as shape manipulation, or combining scenes is not possible. While there are some recent hybrid approaches that combine NeRF with external scene representations such as sparse voxels, planes, hash tables, etc. [16], [5], [24], [9], they focus mostly on efficiency and don't explore the scene editing and manipulation capabilities of hybrid approaches. With the aim of exploring controllable scene representations for novel view synthesis, our model couples learnt scene-specific 3D feature volumes with a general NeRF rendering network. We can generalize to novel scenes by optimizing only the scene-specific 3D feature volume, while keeping the parameters of the rendering network fixed. Since the feature volumes are independent of the rendering model, we can manipulate and combine scenes by editing their corresponding feature volumes. The edited volume can then be plugged into the rendering model to synthesize high-quality novel views. We demonstrate scene manipulations including: scene mixing; applying rigid and non-rigid transformations; inserting, moving and deleting objects in a scene; while producing photo-realistic novel-view synthesis results."
"GAN-Avatar: Controllable Personalized GAN-based Human Head Avatar.","2023","CoRR","Berna Kabadayi, Wojciech Zielonka, Bharat Lal Bhatnagar, Gerard Pons-Moll, Justus Thies","Informal and Other Publications","https://dblp.org/rec/journals/corr/abs-2311-13655","Digital humans and, especially, 3D facial avatars have raised a lot of attention in the past years, as they are the backbone of several applications like immersive telepresence in AR or VR. Despite the progress, facial avatars reconstructed from commodity hardware are incomplete and miss out on parts of the side and back of the head, severely limiting the usability of the avatar. This limitation in prior work stems from their requirement of face tracking, which fails for profile and back views. To address this issue, we propose to learn person-specific animatable avatars from images without assuming to have access to precise facial expression tracking. At the core of our method, we leverage a 3D-aware generative model that is trained to reproduce the distribution of facial expressions from the training data. To train this appearance model, we only assume to have a collection of 2D images with the corresponding camera parameters. For controlling the model, we learn a mapping from 3DMM facial expression parameters to the latent space of the generative model. This mapping can be learned by sampling the latent space of the appearance model and reconstructing the facial parameters from a normalized frontal view, where facial expression estimation performs well. With this scheme, we decouple 3D appearance reconstruction and animation control to achieve high fidelity in image synthesis. In a series of experiments, we compare our proposed technique to state-of-the-art monocular methods and show superior quality while not requiring expression tracking of the training data."
"Generating Continual Human Motion in Diverse 3D Scenes.","2023","CoRR","Aymen Mir, Xavier Puig, Angjoo Kanazawa, Gerard Pons-Moll","Informal and Other Publications","https://dblp.org/rec/journals/corr/abs-2304-02061","We introduce a method to synthesize animator guided human motion across 3D scenes. Given a set of sparse (3 or 4) joint locations (such as the location of a person’s hand and two feet) and a seed motion sequence in a 3D scene, our method generates a plausible motion sequence starting from the seed motion while satisfying the constraints imposed by the provided keypoints. We decompose the continual motion synthesis problem into walking along paths and transitioning in and out of the actions specified by the keypoints, which enables long generation of motions that satisfy scene constraints without explicitly incorporating scene information. Our method is trained only using scene agnostic mocap data. As a result, our approach is deployable across 3D scenes with various geometries. For achieving plausible continual motion synthesis without drift, our key contribution is to iteratively generate motion in a goal-centric canonical coordinate frame where the next immediate target is situated at the origin. Our model can generate long sequences of diverse actions such as grabbing, sitting and leaning chained together in arbitrary order, demonstrated on scenes of varying geometry: HPS, Replica, Matterport, ScanNet scenes. Several experiments demonstrate that our method outperforms existing methods that navigate paths in 3D scenes."
"Geometric Awareness in Neural Fields for 3D Human Registration.","2023","CoRR","Riccardo Marin, Enric Corona, Gerard Pons-Moll","Informal and Other Publications","https://dblp.org/rec/journals/corr/abs-2312-14024",""
"NSF: Neural Surface Fields for Human Modeling from Monocular Depth.","2023","ICCV","Yuxuan Xue, Bharat Lal Bhatnagar, Riccardo Marin, Nikolaos Sarafianos, Yuanlu Xu, Gerard Pons-Moll, Tony Tung","Conference and Workshop Papers","https://dblp.org/rec/conf/iccv/XueBMSXPT23","Obtaining personalized 3D animatable avatars from a monocular camera has several real world applications in gaming, virtual try-on, animation, and VR/XR, etc. However, it is very challenging to model dynamic and finegrained clothing deformations from such sparse data. Existing methods for modeling 3D humans from depth data have limitations in terms of computational efficiency, mesh coherency, and flexibility in resolution and topology. For instance, reconstructing shapes using implicit functions and extracting explicit meshes per frame is computationally expensive and cannot ensure coherent meshes across frames. Moreover, predicting per-vertex deformations on a predesigned human template with a discrete surface lacks flexibility in resolution and topology. To overcome these limitations, we propose a novel method 'NSF : Neural Surface Fields’ for modeling 3D clothed humans from monocular depth. NSF defines a neural field solely on the base surface which models a continuous and flexible displacement field. NSF can be adapted to the base surface with different resolution and topology without retraining at inference time. Compared to existing approaches, our method eliminates the expensive per-frame surface extraction while maintaining mesh coherency, and is capable of reconstructing meshes with arbitrary resolution without retraining. To foster research in this direction, we release our code in project page at: https://yuxuan-xue.com/nsf."
"Object pop-up: Can we infer 3D objects and their poses from human interactions alone?","2023","CVPR","Ilya A. Petrov 0001, Riccardo Marin, Julian Chibane, Gerard Pons-Moll","Conference and Workshop Papers","https://dblp.org/rec/conf/cvpr/0001MCP23","The intimate entanglement between objects affordances and human poses is of large interest, among others, for behavioural sciences, cognitive psychology, and Computer Vision communities. In recent years, the latter has developed several object-centric approaches: starting from items, learning pipelines synthesizing human poses and dynamics in a realistic way, satisfying both geometrical and functional expectations. However, the inverse perspective is significantly less explored: Can we infer 3D objects and their poses from human interactions alone? Our investigation follows this direction, showing that a generic 3D human point cloud is enough to pop up an unobserved object, even when the user is just imitating a functionality (e.g., looking through a binocular) without involving a tangible counterpart. We validate our method qualitatively and quantitatively, with synthetic data and sequences acquired for the task, showing applicability for XR/VR."
"Paint-it: Text-to-Texture Synthesis via Deep Convolutional Texture Map Optimization and Physically-Based Rendering.","2023","CoRR","Kim Youwang, Tae-Hyun Oh, Gerard Pons-Moll","Informal and Other Publications","https://dblp.org/rec/journals/corr/abs-2312-11360","We present Paint-it, a text-driven high-fidelity texture map synthesis method for 3D meshes via neural re-parameterized texture optimization. Paint-it synthesizes texture maps from a text description by synthesis-through-optimization, exploiting the Score-Distillation Sampling (SDS). We observe that directly applying SDS yields undesirable texture quality due to its noisy gradients. We reveal the importance of texture parameterization when using SDS. Specifically, we propose Deep Convolutional Physically-Based Rendering (DC-PBR) parameterization, which re-parameterizes the physically-based rendering (PBR) texture maps with randomly initialized convolution-based neural kernels, instead of a standard pixel-based parameterization. We show that DC-PBR inherently schedules the optimization curriculum according to texture frequency and naturally filters out the noisy signals from SDS. In experiments, Paint-it obtains remarkable quality PBR texture maps within 15 min., given only a text description. We demonstrate the generalizability and practicality of Paint-it by synthesizing high-quality texture maps for large-scale mesh datasets and showing test-time applications such as relighting and material control using a popular graphics engine. Project page: https://kim-youwang.github.io/paint-it."
"SelfPose: 3D Egocentric Pose Estimation From a Headset Mounted Camera.","2023","IEEE Trans. Pattern Anal. Mach. Intell.","Denis Tomè, Thiemo Alldieck, Patrick Peluse, Gerard Pons-Moll, Lourdes Agapito, Hernán Badino, Fernando De la Torre","Journal Articles","https://dblp.org/rec/journals/pami/TomeAPPABT23","We present a new solution to egocentric 3D body pose estimation from monocular images captured from a downward looking fish-eye camera installed on the rim of a head mounted virtual reality device. This unusual viewpoint leads to images with unique visual appearance, characterized by severe self-occlusions and strong perspective distortions that result in a drastic difference in resolution between lower and upper body. We propose a new encoder-decoder architecture with a novel multi-branch decoder designed specifically to account for the varying uncertainty in 2D joint locations. Our quantitative evaluation, both on synthetic and real-world datasets, shows that our strategy leads to substantial improvements in accuracy over state of the art egocentric pose estimation approaches. To tackle the severe lack of labelled training data for egocentric 3D pose estimation we also introduced a large-scale photo-realistic synthetic dataset. <inline-formula><tex-math notation=""LaTeX"">$\boldsymbol{x}$</tex-math><alternatives><mml:math><mml:mi mathvariant=""bold"">x</mml:mi></mml:math><inline-graphic xlink:href=""tome-ieq1-3029700.gif""/></alternatives></inline-formula>R-EgoPose offers 383K frames of high quality renderings of people with diverse skin tones, body shapes and clothing, in a variety of backgrounds and lighting conditions, performing a range of actions. Our experiments show that the high variability in our new synthetic training corpus leads to good generalization to real world footage and to state of the art results on real world datasets with ground truth. Moreover, an evaluation on the Human3.6M benchmark shows that the performance of our method is on par with top performing approaches on the more classic problem of 3D human pose from a third person viewpoint."
"Template Free Reconstruction of Human-object Interaction with Procedural Interaction Generation.","2023","CoRR","Xianghui Xie, Bharat Lal Bhatnagar, Jan Eric Lenssen, Gerard Pons-Moll","Informal and Other Publications","https://dblp.org/rec/journals/corr/abs-2312-07063",""
"Visibility Aware Human-Object Interaction Tracking from Single RGB Camera.","2023","CVPR","Xianghui Xie, Bharat Lal Bhatnagar, Gerard Pons-Moll","Conference and Workshop Papers","https://dblp.org/rec/conf/cvpr/XieBP23","Capturing the interactions between humans and their environment in 3D is important for many applications in robotics, graphics, and vision. Recent works to reconstruct the 3D human and object from a single RGB image do not have consistent relative translation across frames because they assume a fixed depth. Moreover, their performance drops significantly when the object is occluded. In this work, we propose a novel method to track the 3D human, object, contacts, and relative translation across frames from a single RGB camera, while being robust to heavy occlusions. Our method is built on two key insights. First, we condition our neural field reconstructions for human and object on per-frame SMPL model estimates obtained by pre-fitting SMPL to a video sequence. This improves neural reconstruction accuracy and produces coherent relative translation across frames. Second, human and object motion from visible frames provides valuable information to infer the occluded object. We propose a novel transformer-based neural network that explicitly uses object visibility and human motion to leverage neighboring frames to make predictions for the occluded frames. Building on these insights, our method is able to track both human and object robustly even under occlusions. Experiments on two datasets show that our method significantly improves over the state-of-the-art methods. Our code and pretrained models are available at: https://virtualhumans.mpi-inf.mpg.de/VisTracker."
