"title","year","venue","authors","type","url","abstract"
"Learning Disentangled Discrete Representations.","2023","ECML/PKDD","David Friede, Christian Reimers, Heiner Stuckenschmidt, Mathias Niepert","Conference and Workshop Papers","https://dblp.org/rec/conf/pkdd/FriedeRSN23","Recent successes in image generation, model-based reinforcement learning, and text-to-image generation have demonstrated the empirical advantages of discrete latent representations, although the reasons behind their benefits remain unclear. We explore the relationship between discrete latent spaces and disentangled representations by replacing the standard Gaussian variational autoencoder (VAE) with a tailored categorical variational autoencoder. We show that the underlying grid structure of categorical distributions mitigates the problem of rotational invariance associated with multivariate Gaussian distributions, acting as an efficient inductive prior for disentangled representations. We provide both analytical and empirical findings that demonstrate the advantages of discrete VAEs for learning disentangled representations. Furthermore, we introduce the first unsupervised model selection strategy that favors disentangled representations."
"Learning Neural PDE Solvers with Parameter-Guided Channel Attention.","2023","ICML","Makoto Takamoto, Francesco Alesiani, Mathias Niepert","Conference and Workshop Papers","https://dblp.org/rec/conf/icml/TakamotoAN23","&amp;lt;p&amp;gt;Running a high-resolution global climate model can take multiple days on the world's largest supercomputers. Due to the long runtimes that are caused by solving the underlying partial differential equations (PDEs), climate researchers struggle to generate ensemble runs that are necessary for uncertainty quantification or exploring climate policy decisions.&amp;lt;/p&amp;gt;&amp;lt;p&amp;gt;&amp;amp;#160;&amp;lt;/p&amp;gt;&amp;lt;p&amp;gt;Physics-informed neural networks (PINNs) promise a solution: they can solve single instances of PDEs up to three orders of magnitude faster than traditional finite difference numerical solvers. However, most approaches in physics-informed machine learning learn the solution of PDEs over the full spatio-temporal domain, which requires infeasible amounts of training data, does not exploit knowledge of the underlying large-scale physics, and reduces model trust. Our philosophy is to limit learning to the hard-to-model parts. Hence, we are proposing a novel method called \textit{matryoshka neural operator} that leverages an old scheme called super-parametrizations developed in geophysical fluid dynamics. Using this scheme our proposed physics-informed architecture exploits knowledge of approximate large-scale dynamics and only learns the influence of small-scale dynamics onto large-scale dynamics, also called subgrid parametrizations.&amp;lt;/p&amp;gt;&amp;lt;p&amp;gt;&amp;amp;#160;&amp;lt;/p&amp;gt;&amp;lt;p&amp;gt;Some work in geophysical fluid dynamics is conceptually similar, but fully relies on neural networks which can only operate on fixed grids (Gentine et al., 2018). We are the first to learn grid-independent subgrid parametrizations by leveraging neural operators that learn the dynamics in a grid-independent latent space. Neural operators can be seen as an extension of neural networks to infinite-dimensions: They encode infinite-dimensional inputs into a finite-dimensional representations, such as Eigen or Fourier modes, and learn the nonlinear temporal dynamics in the encoded state.&amp;lt;/p&amp;gt;&amp;lt;p&amp;gt;&amp;amp;#160;&amp;lt;/p&amp;gt;&amp;lt;p&amp;gt;We demonstrate the neural operators for learning non-local subgrid parametrizations over the full large-scale domain of the two-scale Lorenz96 equation. We show that the proposed learning-based PDE solver is grid-independent, has quasilinear instead of quadratic complexity in comparison to a fully-resolving numerical solver, is more accurate than current neural network or polynomial-based parametrizations, and offers interpretability through Fourier modes.&amp;lt;/p&amp;gt;&amp;lt;p&amp;gt;&amp;amp;#160;&amp;lt;/p&amp;gt;&amp;lt;p&amp;gt;Gentine, P., Pritchard, M., Rasp, S., Reinaudi, G., and Yacalis, G. (2018). Could machine learning break the convection parameterization deadlock? Geophysical Research Letters, 45, 5742&amp;amp;#8211; 5751. https://doi.org/10.1029/2018GL078202&amp;lt;/p&amp;gt;"
"SIMPLE: A Gradient Estimator for k-Subset Sampling.","2023","ICLR","Kareem Ahmed, Zhe Zeng, Mathias Niepert, Guy Van den Broeck","Conference and Workshop Papers","https://dblp.org/rec/conf/iclr/AhmedZNB23","$k$-subset sampling is ubiquitous in machine learning, enabling regularization and interpretability through sparsity. The challenge lies in rendering $k$-subset sampling amenable to end-to-end learning. This has typically involved relaxing the reparameterized samples to allow for backpropagation, with the risk of introducing high bias and high variance. In this work, we fall back to discrete $k$-subset sampling on the forward pass. This is coupled with using the gradient with respect to the exact marginals, computed efficiently, as a proxy for the true gradient. We show that our gradient estimator, SIMPLE, exhibits lower bias and variance compared to state-of-the-art estimators, including the straight-through Gumbel estimator when $k = 1$. Empirical results show improved performance on learning to explain and sparse linear regression. We provide an algorithm for computing the exact ELBO for the $k$-subset distribution, obtaining significantly lower loss compared to SOTA."
"State-Regularized Recurrent Neural Networks to Extract Automata and Explain Predictions.","2023","IEEE Trans. Pattern Anal. Mach. Intell.","Cheng Wang 0002, Carolin Lawrence, Mathias Niepert","Journal Articles","https://dblp.org/rec/journals/pami/WangLN23","Recurrent neural networks are a widely used class of neural architectures. They have, however, two shortcomings. First, they are often treated as black-box models and as such it is difficult to understand what exactly they learn as well as how they arrive at a particular prediction. Second, they tend to work poorly on sequences requiring long-term memorization, despite having this capacity in principle. We aim to address both shortcomings with a class of recurrent networks that use a stochastic state transition mechanism between cell applications. This mechanism, which we term state-regularization, makes RNNs transition between a finite set of learnable states. We evaluate state-regularized RNNs on (1) regular languages for the purpose of automata extraction; (2) non-regular languages such as balanced parentheses and palindromes where external memory is required; and (3) real-word sequence learning tasks for sentiment analysis, visual object recognition and text categorisation. We show that state-regularization (a) simplifies the extraction of finite state automata that display an RNN's state transition dynamic; (b) forces RNNs to operate more like automata with external memory and less like finite state machines, which potentiality leads to a more structural memory; (c) leads to better interpretability and explainability of RNNs by leveraging the probabilistic finite state transition mechanism over time steps."
"Adaptive Message Passing: A General Framework to Mitigate Oversmoothing, Oversquashing, and Underreaching.","2023","CoRR","Federico Errica, Henrik Christiansen, Viktor Zaverkin, Takashi Maruyama, Mathias Niepert, Francesco Alesiani","Informal and Other Publications","https://dblp.org/rec/journals/corr/abs-2312-16560","Long-range interactions are essential for the correct description of complex systems in many scientific fields. The price to pay for including them in the calculations, however, is a dramatic increase in the overall computational costs. Recently, deep graph networks have been employed as efficient, data-driven surrogate models for predicting properties of complex systems represented as graphs. These models rely on a local and iterative message passing strategy that should, in principle, capture long-range information without explicitly modeling the corresponding interactions. In practice, most deep graph networks cannot really model long-range dependencies due to the intrinsic limitations of (synchronous) message passing, namely oversmoothing, oversquashing, and underreaching. This work proposes a general framework that learns to mitigate these limitations: within a variational inference framework, we endow message passing architectures with the ability to freely adapt their depth and filter messages along the way. With theoretical and empirical arguments, we show that this simple strategy better captures long-range interactions, by surpassing the state of the art on five node and graph prediction datasets suited for this problem. Our approach consistently improves the performances of the baselines tested on these tasks. We complement the exposition with qualitative analyses and ablations to get a deeper understanding of the framework's inner workings."
"Approximate Answering of Graph Queries.","2023","Compendium of Neurosymbolic Artificial Intelligence","Michael Cochez, Dimitrios Alivanistos, Erik Arakelyan, Max Berrendorf, Daniel Daza, Mikhail Galkin 0001, Pasquale Minervini, Mathias Niepert, Hongyu Ren","Parts in Books or Collections","https://dblp.org/rec/series/faia/CochezAABD0MNR23","Knowledge graphs (KGs) are inherently incomplete because of incomplete world knowledge and bias in what is the input to the KG. Additionally, world knowledge constantly expands and evolves, making existing facts deprecated or introducing new ones. However, we would still want to be able to answer queries as if the graph were complete. In this chapter, we will give an overview of several methods which have been proposed to answer queries in such a setting. We will first provide an overview of the different query types which can be supported by these methods and datasets typically used for evaluation, as well as an insight into their limitations. Then, we give an overview of the different approaches and describe them in terms of expressiveness, supported graph types, and inference capabilities."
"Continual Invariant Risk Minimization.","2023","CoRR","Francesco Alesiani, Shujian Yu, Mathias Niepert","Informal and Other Publications","https://dblp.org/rec/journals/corr/abs-2310-13977",""
"Efficient Learning of Discrete-Continuous Computation Graphs.","2023","CoRR","David Friede, Mathias Niepert","Informal and Other Publications","https://dblp.org/rec/journals/corr/abs-2307-14193","Numerous models for supervised and reinforcement learning benefit from combinations of discrete and continuous model components. End-to-end learnable discrete-continuous models are compositional, tend to generalize better, and are more interpretable. A popular approach to building discrete-continuous computation graphs is that of integrating discrete probability distributions into neural networks using stochastic softmax tricks. Prior work has mainly focused on computation graphs with a single discrete component on each of the graph's execution paths. We analyze the behavior of more complex stochastic computations graphs with multiple sequential discrete components. We show that it is challenging to optimize the parameters of these models, mainly due to small gradients and local minima. We then propose two new strategies to overcome these challenges. First, we show that increasing the scale parameter of the Gumbel noise perturbations during training improves the learning behavior. Second, we propose dropout residual connections specifically tailored to stochastic, discrete-continuous computation graphs. With an extensive set of experiments, we show that we can train complex discrete-continuous models which one cannot train with standard stochastic softmax tricks. We also show that complex discrete-stochastic models generalize better than their continuous counterparts on several benchmark datasets."
"Learning Sparsity of Representations with Discrete Latent Variables.","2023","CoRR","Zhao Xu 0001, Daniel Oñoro-Rubio, Giuseppe Serra 0002, Mathias Niepert","Informal and Other Publications","https://dblp.org/rec/journals/corr/abs-2304-00935",""
"On the Out of Distribution Robustness of Foundation Models in Medical Image Segmentation.","2023","CoRR","Duy Minh Ho Nguyen, Tan Ngoc Pham, Nghiem Tuong Diep, Nghi Quoc Phan, Quang Pham, Vinh Tong, Binh T. Nguyen 0001, Ngan Hoang Le, Nhat Ho, Pengtao Xie, Daniel Sonntag, Mathias Niepert","Informal and Other Publications","https://dblp.org/rec/journals/corr/abs-2311-11096",""
"Probabilistically Rewired Message-Passing Neural Networks.","2023","CoRR","Chendi Qian, Andrei Manolache, Kareem Ahmed, Zhe Zeng, Guy Van den Broeck, Mathias Niepert, Christopher Morris 0001","Informal and Other Publications","https://dblp.org/rec/journals/corr/abs-2310-02156","Message-passing graph neural networks (MPNNs) emerged as powerful tools for processing graph-structured input. However, they operate on a fixed input graph structure, ignoring potential noise and missing information. Furthermore, their local aggregation mechanism can lead to problems such as over-squashing and limited expressive power in capturing relevant graph structures. Existing solutions to these challenges have primarily relied on heuristic methods, often disregarding the underlying data distribution. Hence, devising principled approaches for learning to infer graph structures relevant to the given prediction task remains an open challenge. In this work, leveraging recent progress in exact and differentiable $k$-subset sampling, we devise probabilistically rewired MPNNs (PR-MPNNs), which learn to add relevant edges while omitting less beneficial ones. For the first time, our theoretical analysis explores how PR-MPNNs enhance expressive power, and we identify precise conditions under which they outperform purely randomized approaches. Empirically, we demonstrate that our approach effectively mitigates issues like over-squashing and under-reaching. In addition, on established real-world datasets, our method exhibits competitive or superior predictive performance compared to traditional MPNN models and recent graph transformer architectures."
"Tractable Probabilistic Graph Representation Learning with Graph-Induced Sum-Product Networks.","2023","CoRR","Federico Errica, Mathias Niepert","Informal and Other Publications","https://dblp.org/rec/journals/corr/abs-2305-10544","We introduce Graph-Induced Sum-Product Networks (GSPNs), a new probabilistic framework for graph representation learning that can tractably answer probabilistic queries. Inspired by the computational trees induced by vertices in the context of message-passing neural networks, we build hierarchies of sum-product networks (SPNs) where the parameters of a parent SPN are learnable transformations of the a-posterior mixing probabilities of its children's sum units. Due to weight sharing and the tree-shaped computation graphs of GSPNs, we obtain the efficiency and efficacy of deep graph networks with the additional advantages of a probabilistic model. We show the model's competitiveness on scarce supervision scenarios, under missing data, and for graph classification in comparison to popular neural models. We complement the experiments with qualitative analyses on hyper-parameters and the model's ability to answer probabilistic queries."
