"title","year","venue","authors","type","url","abstract"
"Benchmarking Neural Network Training Algorithms.","2023","CoRR","George E. Dahl, Frank Schneider 0001, Zachary Nado, Naman Agarwal, Chandramouli Shama Sastry, Philipp Hennig, Sourabh Medapati, Runa Eschenhagen, Priya Kasimbeg, Daniel Suo, Juhan Bae, Justin Gilmer, Abel L. Peirson, Bilal Khan, Rohan Anil, Mike Rabbat, Shankar Krishnan, Daniel Snider, Ehsan Amid, Kongtao Chen, Chris J. Maddison, Rakshith Vasudev, Michal Badura, Ankush Garg, Peter Mattson","Informal and Other Publications","https://dblp.org/rec/journals/corr/abs-2306-07179","Training algorithms, broadly construed, are an essential part of every deep learning pipeline. Training algorithm improvements that speed up training across a wide variety of workloads (e.g., better update rules, tuning protocols, learning rate schedules, or data selection schemes) could save time, save computational resources, and lead to better, more accurate, models. Unfortunately, as a community, we are currently unable to reliably identify training algorithm improvements, or even determine the state-of-the-art training algorithm. In this work, using concrete experiments, we argue that real progress in speeding up training requires new benchmarks that resolve three basic challenges faced by empirical comparisons of training algorithms: (1) how to decide when training is complete and precisely measure training time, (2) how to handle the sensitivity of measurements to exact workload details, and (3) how to fairly compare algorithms that require hyperparameter tuning. In order to address these challenges, we introduce a new, competitive, time-to-result benchmark using multiple workloads running on fixed hardware, the AlgoPerf: Training Algorithms benchmark. Our benchmark includes a set of workload variants that make it possible to detect benchmark submissions that are more robust to workload changes than current widely-used methods. Finally, we evaluate baseline submissions constructed using various optimizers that represent current practice, as well as other optimizers that have recently received attention in the literature. These baseline results collectively demonstrate the feasibility of our benchmark, show that non-trivial gaps between methods exist, and set a provisional state-of-the-art for future benchmark submissions to try and surpass."
"Kronecker-Factored Approximate Curvature for Modern Neural Network Architectures.","2023","NeurIPS","Runa Eschenhagen, Alexander Immer, Richard E. Turner, Frank Schneider 0001, Philipp Hennig","Conference and Workshop Papers","https://dblp.org/rec/conf/nips/EschenhagenIT0H23",""
"Parallel-in-Time Probabilistic Numerical ODE Solvers.","2023","CoRR","Nathanael Bosch, Adrien Corenflos, Fatemeh Yaghoobi, Filip Tronarp, Philipp Hennig, Simo Särkkä","Informal and Other Publications","https://dblp.org/rec/journals/corr/abs-2310-01145","Probabilistic numerical solvers for ordinary differential equations (ODEs) treat the numerical simulation of dynamical systems as problems of Bayesian state estimation. Aside from producing posterior distributions over ODE solutions and thereby quantifying the numerical approximation error of the method itself, one less-often noted advantage of this formalism is the algorithmic flexibility gained by formulating numerical simulation in the framework of Bayesian filtering and smoothing. In this paper, we leverage this flexibility and build on the time-parallel formulation of iterated extended Kalman smoothers to formulate a parallel-in-time probabilistic numerical ODE solver. Instead of simulating the dynamical system sequentially in time, as done by current probabilistic solvers, the proposed method processes all time steps in parallel and thereby reduces the span cost from linear to logarithmic in the number of time steps. We demonstrate the effectiveness of our approach on a variety of ODEs and compare it to a range of both classic and probabilistic numerical ODE solvers."
"Probabilistic Exponential Integrators.","2023","NeurIPS","Nathanael Bosch, Philipp Hennig, Filip Tronarp","Conference and Workshop Papers","https://dblp.org/rec/conf/nips/BoschHT23","Probabilistic solvers provide a flexible and efficient framework for simulation, uncertainty quantification, and inference in dynamical systems. However, like standard solvers, they suffer performance penalties for certain stiff systems, where small steps are required not for reasons of numerical accuracy but for the sake of stability. This issue is greatly alleviated in semi-linear problems by the probabilistic exponential integrators developed in this paper. By including the fast, linear dynamics in the prior, we arrive at a class of probabilistic integrators with favorable properties. Namely, they are proven to be L-stable, and in a certain case reduce to a classic exponential integrator -- with the added benefit of providing a probabilistic account of the numerical error. The method is also generalized to arbitrary non-linear systems by imposing piece-wise semi-linearity on the prior via Jacobians of the vector field at the previous estimates, resulting in probabilistic exponential Rosenbrock methods. We evaluate the proposed methods on multiple stiff differential equations and demonstrate their improved stability and efficiency over established probabilistic solvers. The present contribution thus expands the range of problems that can be effectively tackled within probabilistic numerics."
"Sample Path Regularity of Gaussian Processes from the Covariance Kernel.","2023","CoRR","Nathaël Da Costa, Marvin Pförtner, Lancelot Da Costa, Philipp Hennig","Informal and Other Publications","https://dblp.org/rec/journals/corr/abs-2312-14886",""
"The Geometry of Neural Nets' Parameter Spaces Under Reparametrization.","2023","NeurIPS","Agustinus Kristiadi, Felix Dangel, Philipp Hennig","Conference and Workshop Papers","https://dblp.org/rec/conf/nips/KristiadiDH23","Model reparametrization, which follows the change-of-variable rule of calculus, is a popular way to improve the training of neural nets. But it can also be problematic since it can induce inconsistencies in, e.g., Hessian-based flatness measures, optimization trajectories, and modes of probability densities. This complicates downstream analyses: e.g. one cannot definitively relate flatness with generalization since arbitrary reparametrization changes their relationship. In this work, we study the invariance of neural nets under reparametrization from the perspective of Riemannian geometry. From this point of view, invariance is an inherent property of any neural net if one explicitly represents the metric and uses the correct associated transformation rules. This is important since although the metric is always present, it is often implicitly assumed as identity, and thus dropped from the notation, then lost under reparametrization. We discuss implications for measuring the flatness of minima, optimization, and for probability-density maximization. Finally, we explore some interesting directions where invariance is useful."
"The Rank-Reduced Kalman Filter: Approximate Dynamical-Low-Rank Filtering In High Dimensions.","2023","NeurIPS","Jonathan Schmidt, Philipp Hennig, Jörg Nick, Filip Tronarp","Conference and Workshop Papers","https://dblp.org/rec/conf/nips/SchmidtHNT23",""
"Uncertainty and Structure in Neural Ordinary Differential Equations.","2023","CoRR","Katharina Ott, Michael Tiemann, Philipp Hennig","Informal and Other Publications","https://dblp.org/rec/journals/corr/abs-2305-13290","Neural ordinary differential equations (ODEs) are an emerging class of deep learning models for dynamical systems. They are particularly useful for learning an ODE vector field from observed trajectories (i.e., inverse problems). We here consider aspects of these models relevant for their application in science and engineering. Scientific predictions generally require structured uncertainty estimates. As a first contribution, we show that basic and lightweight Bayesian deep learning techniques like the Laplace approximation can be applied to neural ODEs to yield structured and meaningful uncertainty quantification. But, in the scientific domain, available information often goes beyond raw trajectories, and also includes mechanistic knowledge, e.g., in the form of conservation laws. We explore how mechanistic knowledge and uncertainty quantification interact on two recently proposed neural ODE frameworks - symplectic neural ODEs and physical models augmented with neural ODEs. In particular, uncertainty reflects the effect of mechanistic information more directly than the predictive power of the trained model could. And vice versa, structure can improve the extrapolation abilities of neural ODEs, a fact that can be best assessed in practice through uncertainty estimates. Our experimental analysis demonstrates the effectiveness of the Laplace approach on both low dimensional ODE problems and a high dimensional partial differential equation."
