"title","year","venue","authors","type","url","abstract"
"Are Pose Estimators Ready for the Open World? STAGE: Synthetic Data Generation Toolkit for Auditing 3D Human Pose Estimators.","2024","CoRR","Nikita Kister, István Sárándi, Anna Khoreva, Gerard Pons-Moll","Informal and Other Publications","https://dblp.org/rec/journals/corr/abs-2408-16536",""
"CloSe: A 3D Clothing Segmentation Dataset and Model.","2024","3DV","Dimitrije Antic, Garvita Tiwari, Batuhan Ozcomlekci, Riccardo Marin, Gerard Pons-Moll","Conference and Workshop Papers","https://dblp.org/rec/conf/3dim/AnticTOMP24","3D Clothing modeling and datasets play crucial role in the entertainment, animation, and digital fashion industries. Existing work often lacks detailed semantic understanding or uses synthetic datasets, lacking realism and personalization. To address this, we first introduce CloSe-D: a novel large-scale dataset containing 3D clothing segmentation of 3167 scans, covering a range of 18 distinct clothing classes. Additionally, we propose CloSe-Net, the first learning-based 3D clothing segmentation model for fine-grained segmentation from colored point clouds. CloSe-Net uses local point features, body-clothing correlation, and a garment-class and point features-based attention module, improving performance over baselines and prior work. The proposed attention module enables our model to learn appearance and geometry-dependent clothing prior from data. We further validate the efficacy of our approach by successfully segmenting publicly available datasets of people in clothing. We also introduce CloSe-T, a 3D interactive tool for refining segmentation labels. Combining the tool with CloSe-Net in a continual learning setup demonstrates improved generalization on real-world data. Dataset, model, and tool can be found at https://virtualhumans.mpi-inf.mpg.de/close3dv24/."
"FORCE: Dataset and Method for Intuitive Physics Guided Human-object Interaction.","2024","CoRR","Xiaohan Zhang, Bharat Lal Bhatnagar, Sebastian Starke, Ilya Petrov, Vladimir Guzov, Helisa Dhamo, Eduardo Pérez-Pellitero, Gerard Pons-Moll","Informal and Other Publications","https://dblp.org/rec/journals/corr/abs-2403-11237","Interactions between human and objects are influenced not only by the object's pose and shape, but also by physical attributes such as object mass and surface friction. They introduce important motion nuances that are essential for diversity and realism. Despite advancements in recent kinematics-based methods, this aspect has been overlooked. Generating nuanced human motion presents two challenges. First, it is non-trivial to learn from multi-modal human and object information derived from both the physical and non-physical attributes. Second, there exists no dataset capturing nuanced human interactions with objects of varying physical properties, hampering model development. This work addresses the gap by introducing the FORCE model, a kinematic approach for synthesizing diverse, nuanced human-object interactions by modeling physical attributes. Our key insight is that human motion is dictated by the interrelation between the force exerted by the human and the perceived resistance. Guided by a novel intuitive physics encoding, the model captures the interplay between human force and resistance. Experiments also demonstrate incorporating human force facilitates learning multi-class motion. Accompanying our model, we contribute the FORCE dataset. It features diverse, different-styled motion through interactions with varying resistances."
"GAN-Avatar: Controllable Personalized GAN-based Human Head Avatar.","2024","3DV","Berna Kabadayi, Wojciech Zielonka, Bharat Lal Bhatnagar, Gerard Pons-Moll, Justus Thies","Conference and Workshop Papers","https://dblp.org/rec/conf/3dim/KabadayiZBPT24","Digital humans and, especially, 3D facial avatars have raised a lot of attention in the past years, as they are the backbone of several applications like immersive telepresence in AR or VR. Despite the progress, facial avatars reconstructed from commodity hardware are incomplete and miss out on parts of the side and back of the head, severely limiting the usability of the avatar. This limitation in prior work stems from their requirement of face tracking, which fails for profile and back views. To address this issue, we propose to learn person-specific animatable avatars from images without assuming to have access to precise facial expression tracking. At the core of our method, we leverage a 3D-aware generative model that is trained to reproduce the distribution of facial expressions from the training data. To train this appearance model, we only assume to have a collection of 2D images with the corresponding camera parameters. For controlling the model, we learn a mapping from 3DMM facial expression parameters to the latent space of the generative model. This mapping can be learned by sampling the latent space of the appearance model and reconstructing the facial parameters from a normalized frontal view, where facial expression estimation performs well. With this scheme, we decouple 3D appearance reconstruction and animation control to achieve high fidelity in image synthesis. In a series of experiments, we compare our proposed technique to state-of-the-art monocular methods and show superior quality while not requiring expression tracking of the training data."
"GEARS: Local Geometry-Aware Hand-Object Interaction Synthesis.","2024","CVPR","Keyang Zhou, Bharat Lal Bhatnagar, Jan Eric Lenssen, Gerard Pons-Moll","Conference and Workshop Papers","https://dblp.org/rec/conf/cvpr/ZhouBLP24",""
"Generating Continual Human Motion in Diverse 3D Scenes.","2024","3DV","Aymen Mir, Xavier Puig, Angjoo Kanazawa, Gerard Pons-Moll","Conference and Workshop Papers","https://dblp.org/rec/conf/3dim/MirPKP24","We introduce a method to synthesize animator guided human motion across 3D scenes. Given a set of sparse (3 or 4) joint locations (such as the location of a person’s hand and two feet) and a seed motion sequence in a 3D scene, our method generates a plausible motion sequence starting from the seed motion while satisfying the constraints imposed by the provided keypoints. We decompose the continual motion synthesis problem into walking along paths and transitioning in and out of the actions specified by the keypoints, which enables long generation of motions that satisfy scene constraints without explicitly incorporating scene information. Our method is trained only using scene agnostic mocap data. As a result, our approach is deployable across 3D scenes with various geometries. For achieving plausible continual motion synthesis without drift, our key contribution is to iteratively generate motion in a goal-centric canonical coordinate frame where the next immediate target is situated at the origin. Our model can generate long sequences of diverse actions such as grabbing, sitting and leaning chained together in arbitrary order, demonstrated on scenes of varying geometry: HPS, Replica, Matterport, ScanNet scenes. Several experiments demonstrate that our method outperforms existing methods that navigate paths in 3D scenes."
"HMD2: Environment-aware Motion Generation from Single Egocentric Head-Mounted Device.","2024","CoRR","Vladimir Guzov, Yifeng Jiang 0002, Fangzhou Hong, Gerard Pons-Moll, Richard A. Newcombe, C. Karen Liu, Yuting Ye, Lingni Ma","Informal and Other Publications","https://dblp.org/rec/journals/corr/abs-2409-13426","This paper investigates the online generation of realistic full-body human motion using a single head-mounted device with an outward-facing color camera and the ability to perform visual SLAM. Given the inherent ambiguity of this setup, we introduce a novel system, HMD$^2$, designed to balance between motion reconstruction and generation. From a reconstruction standpoint, our system aims to maximally utilize the camera streams to produce both analytical and learned features, including head motion, SLAM point cloud, and image embeddings. On the generative front, HMD$^2$ employs a multi-modal conditional motion Diffusion model, incorporating a time-series backbone to maintain temporal coherence in generated motions, and utilizes autoregressive in-painting to facilitate online motion inference with minimal latency (0.17 seconds). Collectively, we demonstrate that our system offers a highly effective and robust solution capable of scaling to an extensive dataset of over 200 hours collected in a wide range of complex indoor and outdoor environments using publicly available smart glasses."
"Human 3Diffusion: Realistic Avatar Creation via Explicit 3D Consistent Diffusion Models.","2024","CoRR","Yuxuan Xue, Xianghui Xie, Riccardo Marin, Gerard Pons-Moll","Informal and Other Publications","https://dblp.org/rec/journals/corr/abs-2406-08475","Creating realistic avatars from a single RGB image is an attractive yet challenging problem. Due to its ill-posed nature, recent works leverage powerful prior from 2D diffusion models pretrained on large datasets. Although 2D diffusion models demonstrate strong generalization capability, they cannot provide multi-view shape priors with guaranteed 3D consistency. We propose Human 3Diffusion: Realistic Avatar Creation via Explicit 3D Consistent Diffusion. Our key insight is that 2D multi-view diffusion and 3D reconstruction models provide complementary information for each other, and by coupling them in a tight manner, we can fully leverage the potential of both models. We introduce a novel image-conditioned generative 3D Gaussian Splats reconstruction model that leverages the priors from 2D multi-view diffusion models, and provides an explicit 3D representation, which further guides the 2D reverse sampling process to have better 3D consistency. Experiments show that our proposed framework outperforms state-of-the-art methods and enables the creation of realistic avatars from a single RGB image, achieving high-fidelity in both geometry and appearance. Extensive ablations also validate the efficacy of our design, (1) multi-view 2D priors conditioning in generative 3D reconstruction and (2) consistency refinement of sampling trajectory via the explicit 3D representation. Our code and models will be released on https://yuxuan-xue.com/human-3diffusion."
"InterTrack: Tracking Human Object Interaction without Object Templates.","2024","CoRR","Xianghui Xie, Jan Eric Lenssen, Gerard Pons-Moll","Informal and Other Publications","https://dblp.org/rec/journals/corr/abs-2408-13953","Tracking human object interaction from videos is important to understand human behavior from the rapidly growing stream of video data. Previous video-based methods require predefined object templates while single-image-based methods are template-free but lack temporal consistency. In this paper, we present a method to track human object interaction without any object shape templates. We decompose the 4D tracking problem into per-frame pose tracking and canonical shape optimization. We first apply a single-view reconstruction method to obtain temporally-inconsistent per-frame interaction reconstructions. Then, for the human, we propose an efficient autoencoder to predict SMPL vertices directly from the per-frame reconstructions, introducing temporally consistent correspondence. For the object, we introduce a pose estimator that leverages temporal information to predict smooth object rotations under occlusions. To train our model, we propose a method to generate synthetic interaction videos and synthesize in total 10 hour videos of 8.5k sequences with full 3D ground truth. Experiments on BEHAVE and InterCap show that our method significantly outperforms previous template-based video tracking and single-frame reconstruction methods. Our proposed synthetic video dataset also allows training video-based methods that generalize to real-world videos. Our code and dataset will be publicly released."
"Interaction Replica: Tracking Human-Object Interaction and Scene Changes From Human Motion.","2024","3DV","Vladimir Guzov, Julian Chibane, Riccardo Marin, Yannan He, Yunus Saracoglu, Torsten Sattler, Gerard Pons-Moll","Conference and Workshop Papers","https://dblp.org/rec/conf/3dim/GuzovCMHSSP24",""
"LayerNet: High-Resolution Semantic 3D Reconstruction of Clothed People.","2024","IEEE Trans. Pattern Anal. Mach. Intell.","Enric Corona, Guillem Alenyà, Gerard Pons-Moll, Francesc Moreno-Noguer","Journal Articles","https://dblp.org/rec/journals/pami/CoronaAPM24","In this article, we introduce SMPLicit, a novel generative model to jointly represent body pose, shape and clothing geometry; and LayerNet, a deep network that given a single image of a person simultaneously performs detailed 3D reconstruction of body and clothes. In contrast to existing learning-based approaches that require training specific models for each type of garment, SMPLicit can represent in a unified manner different garment topologies (e.g. from sleeveless tops to hoodies and open jackets), while controlling other properties like garment size or tightness/looseness. LayerNet follows a coarse-to-fine multi-stage strategy by first predicting smooth cloth geometries from SMPLicit, which are then refined by an image-guided displacement network that gracefully fits the body recovering high-frequency details and wrinkles. LayerNet achieves competitive accuracy in the task of 3D reconstruction against current ‘garment-agnostic’ state of the art for images of people in up-right positions and controlled environments, and consistently surpasses these methods on challenging body poses and uncontrolled settings. Furthermore, the semantically rich outcome of our approach is suitable for performing Virtual Try-on tasks directly on 3D, a task which, so far, has only been addressed in the 2D domain."
"NRDF: Neural Riemannian Distance Fields for Learning Articulated Pose Priors.","2024","CVPR","Yannan He, Garvita Tiwari, Tolga Birdal, Jan Eric Lenssen, Gerard Pons-Moll","Conference and Workshop Papers","https://dblp.org/rec/conf/cvpr/HeTBLP24",""
"Neural Localizer Fields for Continuous 3D Human Pose and Shape Estimation.","2024","CoRR","István Sárándi, Gerard Pons-Moll","Informal and Other Publications","https://dblp.org/rec/journals/corr/abs-2407-07532","With the explosive growth of available training data, single-image 3D human modeling is ahead of a transition to a data-centric paradigm. A key to successfully exploiting data scale is to design flexible models that can be supervised from various heterogeneous data sources produced by different researchers or vendors. To this end, we propose a simple yet powerful paradigm for seamlessly unifying different human pose and shape-related tasks and datasets. Our formulation is centered on the ability - both at training and test time - to query any arbitrary point of the human volume, and obtain its estimated location in 3D. We achieve this by learning a continuous neural field of body point localizer functions, each of which is a differently parameterized 3D heatmap-based convolutional point localizer (detector). For generating parametric output, we propose an efficient post-processing step for fitting SMPL-family body models to nonparametric joint and vertex predictions. With this approach, we can naturally exploit differently annotated data sources including mesh, 2D/3D skeleton and dense pose, without having to convert between them, and thereby train large-scale 3D human mesh and skeleton estimation models that outperform the state-of-the-art on several public benchmarks including 3DPW, EMDB and SSP-3D by a considerable margin."
"Paint-it: Text-to-Texture Synthesis via Deep Convolutional Texture Map Optimization and Physically-Based Rendering.","2024","CVPR","Kim Youwang, Tae-Hyun Oh, Gerard Pons-Moll","Conference and Workshop Papers","https://dblp.org/rec/conf/cvpr/YouwangOP24","We present Paint-it, a text-driven high-fidelity texture map synthesis method for 3D meshes via neural re-parameterized texture optimization. Paint-it synthesizes texture maps from a text description by synthesis-through-optimization, exploiting the Score-Distillation Sampling (SDS). We observe that directly applying SDS yields undesirable texture quality due to its noisy gradients. We reveal the importance of texture parameterization when using SDS. Specifically, we propose Deep Convolutional Physically-Based Rendering (DC-PBR) parameterization, which re-parameterizes the physically-based rendering (PBR) texture maps with randomly initialized convolution-based neural kernels, instead of a standard pixel-based parameterization. We show that DC-PBR inherently schedules the optimization curriculum according to texture frequency and naturally filters out the noisy signals from SDS. In experiments, Paint-it obtains remarkable quality PBR texture maps within 15 min., given only a text description. We demonstrate the generalizability and practicality of Paint-it by synthesizing high-quality texture maps for large-scale mesh datasets and showing test-time applications such as relighting and material control using a popular graphics engine. Project page: https://kim-youwang.github.io/paint-it."
"RHOBIN Challenge: Reconstruction of Human Object Interaction.","2024","CoRR","Xianghui Xie, Xi Wang, Nikos Athanasiou, Bharat Lal Bhatnagar, Chun-Hao P. Huang, Kaichun Mo, Hao Chen, Xia Jia, Zerui Zhang, Liangxian Cui, Xiao Lin, Bingqiao Qian, Jie Xiao, Wenfei Yang, Hyeongjin Nam, Daniel Sungho Jung, Kihoon Kim, Kyoung Mu Lee, Otmar Hilliges, Gerard Pons-Moll","Informal and Other Publications","https://dblp.org/rec/journals/corr/abs-2401-04143","Modeling the interaction between humans and objects has been an emerging research direction in recent years. Capturing human-object interaction is however a very challenging task due to heavy occlusion and complex dynamics, which requires understanding not only 3D human pose, and object pose but also the interaction between them. Reconstruction of 3D humans and objects has been two separate research fields in computer vision for a long time. We hence proposed the first RHOBIN challenge: reconstruction of human-object interactions in conjunction with the RHOBIN workshop. It was aimed at bringing the research communities of human and object reconstruction as well as interaction modeling together to discuss techniques and exchange ideas. Our challenge consists of three tracks of 3D reconstruction from monocular RGB images with a focus on dealing with challenging interaction scenarios. Our challenge attracted more than 100 participants with more than 300 submissions, indicating the broad interest in the research communities. This paper describes the settings of our challenge and discusses the winning methods of each track in more detail. We observe that the human reconstruction task is becoming mature even under heavy occlusion settings while object pose estimation and joint reconstruction remain challenging tasks. With the growing interest in interaction modeling, we hope this report can provide useful insights and foster future research in this direction. Our workshop website can be found at \href{https://rhobin-challenge.github.io/}{https://rhobin-challenge.github.io/}."
"Recent Trends in 3D Reconstruction of General Non-Rigid Scenes.","2024","Comput. Graph. Forum","Raza Yunus, Jan Eric Lenssen, Michael Niemeyer, Yiyi Liao, Christian Rupprecht 0001, Christian Theobalt, Gerard Pons-Moll, Jia-Bin Huang, Vladislav Golyanik, Eddy Ilg","Journal Articles","https://dblp.org/rec/journals/cgf/YunusLNLRTPHGI24","AbstractReconstructing models of the real world, including 3D geometry, appearance, and motion of real scenes, is essential for computer graphics and computer vision. It enables the synthesizing of photorealistic novel views, useful for the movie industry and AR/VR applications. It also facilitates the content creation necessary in computer games and AR/VR by avoiding laborious manual design processes. Further, such models are fundamental for intelligent computing systems that need to interpret real‐world scenes and actions to act and interact safely with the human world. Notably, the world surrounding us is dynamic, and reconstructing models of dynamic, non‐rigidly moving scenes is a severely underconstrained and challenging problem. This state‐of‐the‐art report (STAR) offers the reader a comprehensive summary of state‐of‐the‐art techniques with monocular and multi‐view inputs such as data from RGB and RGB‐D sensors, among others, conveying an understanding of different approaches, their potential applications, and promising further research directions. The report covers 3D reconstruction of general non‐rigid scenes and further addresses the techniques for scene decomposition, editing and controlling, and generalizable and generative modeling. More specifically, we first review the common and fundamental concepts necessary to understand and navigate the field and then discuss the state‐of‐the‐art techniques by reviewing recent approaches that use traditional and machine‐learning‐based neural representations, including a discussion on the newly enabled applications. The STAR is concluded with a discussion of the remaining limitations and open challenges."
"Template Free Reconstruction of Human-object Interaction with Procedural Interaction Generation.","2024","CVPR","Xianghui Xie, Bharat Lal Bhatnagar, Jan Eric Lenssen, Gerard Pons-Moll","Conference and Workshop Papers","https://dblp.org/rec/conf/cvpr/XieBLP24","Reconstructing human-object interaction in 3D from a single RGB image is a challenging task and existing data driven methods do not generalize beyond the objects present in the carefully curated 3D interaction datasets. Capturing large-scale real data to learn strong interaction and 3D shape priors is very expensive due to the combinato-rial nature of human-object interactions. In this paper, we propose ProciGen (Procedural interaction Generation), a method to procedurally generate datasets with both, plau-sible interaction and diverse object variation. We gener-ate 1M+ human-object interaction pairs in 3D and lever-age this large-scale data to train our HDM (Hierarchical Diffusion Model), a novel method to reconstruct interacting human and unseen object instances, without any tem-plates. Our HDM is an image-conditioned diffusion model that learns both realistic interaction and highly accurate human and object shapes. Experiments show that our HDM trained with ProciGen significantly outperforms prior meth-ods that require template meshes, and our dataset allows training methods with strong generalization ability to un-seen object instances. Our code and data are released."
"Unimotion: Unifying 3D Human Motion Synthesis and Understanding.","2024","CoRR","Chuqiao Li, Julian Chibane, Yannan He, Naama Pearl, Andreas Geiger 0001, Gerard Pons-Moll","Informal and Other Publications","https://dblp.org/rec/journals/corr/abs-2409-15904","We introduce Unimotion, the first unified multi-task human motion model capable of both flexible motion control and frame-level motion understanding. While existing works control avatar motion with global text conditioning, or with fine-grained per frame scripts, none can do both at once. In addition, none of the existing works can output frame-level text paired with the generated poses. In contrast, Unimotion allows to control motion with global text, or local frame-level text, or both at once, providing more flexible control for users. Importantly, Unimotion is the first model which by design outputs local text paired with the generated poses, allowing users to know what motion happens and when, which is necessary for a wide range of applications. We show Unimotion opens up new applications: 1.) Hierarchical control, allowing users to specify motion at different levels of detail, 2.) Obtaining motion text descriptions for existing MoCap data or YouTube videos 3.) Allowing for editability, generating motion from text, and editing the motion via text edits. Moreover, Unimotion attains state-of-the-art results for the frame-level text-to-motion task on the established HumanML3D dataset. The pre-trained model and code are available available on our project page at https://coral79.github.io/uni-motion/."
"A Deeper Look into DeepCap (Invited Paper).","2023","IEEE Trans. Pattern Anal. Mach. Intell.","Marc Habermann, Weipeng Xu, Michael Zollhöfer, Gerard Pons-Moll, Christian Theobalt","Journal Articles","https://dblp.org/rec/journals/pami/HabermannXZPT23","Human performance capture is a highly important computer vision problem with many applications in movie production and virtual/augmented reality. Many previous performance capture approaches either required expensive multi-view setups or did not recover dense space-time coherent geometry with frame-to-frame correspondences. We propose a novel deep learning approach for monocular dense human performance capture. Our method is trained in a weakly supervised manner based on multi-view supervision completely removing the need for training data with 3D ground truth annotations. The network architecture is based on two separate networks that disentangle the task into a pose estimation and a non-rigid surface deformation step. Extensive qualitative and quantitative evaluations show that our approach outperforms the state of the art in terms of quality and robustness. This work is an extended version of [1] where we provide more detailed explanations, comparisons and results as well as applications."
