"title","year","venue","authors","type","url","abstract"
"Neglected Free Lunch; Learning Image Classifiers Using Annotation Byproducts.","2023","CoRR","Dongyoon Han, Junsuk Choe, Seonghyeok Chun, John Joon Young Chung, Minsuk Chang, Sangdoo Yun, Jean Y. Song, Seong Joon Oh","Informal and Other Publications","https://dblp.org/rec/journals/corr/abs-2303-17595","Supervised learning of image classifiers distills human knowledge into a parametric model fθ through pairs of images and corresponding labels $\left\{ {\left( {{X_i},{Y_i}} \right)} \right\}_{i = 1}^N$. We argue that this simple and widely used representation of human knowledge neglects rich auxiliary information from the annotation procedure, such as the time-series of mouse traces and clicks left after image selection. Our insight is that such annotation byproducts Z provide approximate human attention that weakly guides the model to focus on the foreground cues, reducing spurious correlations and discouraging shortcut learning. To verify this, we create ImageNet-AB and COCO-AB. They are ImageNet and COCO training sets enriched with sample-wise annotation byproducts, collected by replicating the respective original annotation tasks. We refer to the new paradigm of training models with annotation byproducts as learning using annotation byproducts (LUAB). We show that a simple multitask loss for regressing Z together with Y already improves the generalisability and robustness of the learned models. Compared to the original supervised learning, LUAB does not require extra annotation costs. ImageNet-AB and COCO-AB are at github.com/naverai/NeglectedFreeLunch."
"Scratching Visual Transformer's Back with Uniform Attention.","2023","ICCV","Nam Hyeon-Woo, Kim Yu-Ji, Byeongho Heo, Dongyoon Han, Seong Joon Oh, Tae-Hyun Oh","Conference and Workshop Papers","https://dblp.org/rec/conf/iccv/Hyeon-WooYHHOO23","The favorable performance of Vision Transformers (ViTs) is often attributed to the multi-head self-attention (MSA), which enables global interactions at each layer of a ViT model. Previous works acknowledge the property of long-range dependency for the effectiveness in MSA. In this work, we study the role of MSA in terms of the different axis, density. Our preliminary analyses suggest that the spatial interactions of learned attention maps are close to dense interactions rather than sparse ones. This is a curious phenomenon because dense attention maps are harder for the model to learn due to softmax. We interpret this opposite behavior against softmax as a strong preference for the ViT models to include dense interaction. We thus manually insert the dense uniform attention to each layer of the ViT models to supply the much-needed dense interactions. We call this method Context Broadcasting, CB. Our study demonstrates the inclusion of CB takes the role of dense attention and thereby reduces the degree of density in the original attention maps by complying softmax in MSA. We also show that, with negligible costs of CB (1 line in your model code and no additional parameters), both the capacity and generalizability of the ViT models are increased."
"Do Deep Neural Network Solutions Form a Star Domain?","2024","CoRR","Ankit Sonthalia, Alexander Rubinstein 0002, Ehsan Abbasnejad, Seong Joon Oh","Informal and Other Publications","https://dblp.org/rec/journals/corr/abs-2403-07968","It has recently been conjectured that neural network solution sets reachable via stochastic gradient descent (SGD) are convex, considering permutation invariances (Entezari et al., 2022). This means that a linear path can connect two independent solutions with low loss, given the weights of one of the models are appropriately permuted. However, current methods to test this theory often require very wide networks to succeed. In this work, we conjecture that more generally, the SGD solution set is a""star domain""that contains a""star model""that is linearly connected to all the other solutions via paths with low loss values, modulo permutations. We propose the Starlight algorithm that finds a star model of a given learning task. We validate our claim by showing that this star model is linearly connected with other independently found solutions. As an additional benefit of our study, we demonstrate better uncertainty estimates on the Bayesian Model Averaging over the obtained star domain. Further, we demonstrate star models as potential substitutes for model ensembles. Our code is available at https://github.com/aktsonthalia/starlight."
"Scalable Ensemble Diversification for OOD Generalization and Detection.","2024","CoRR","Alexander Rubinstein 0002, Luca Scimeca, Damien Teney, Seong Joon Oh","Informal and Other Publications","https://dblp.org/rec/journals/corr/abs-2409-16797","Deep neural network (DNN) models are usually built based on the i.i.d. (independent and identically distributed), also known as in-distribution (ID), assumption on the training samples and test data. However, when models are deployed in a real-world scenario with some distributional shifts, test data can be out-of-distribution (OOD) and both OOD detection and OOD generalization should be simultaneously addressed to ensure the reliability and safety of applied AI systems. Most existing OOD detectors pursue these two goals separately, and therefore, are sensitive to covariate shift rather than semantic shift. To alleviate this problem, this paper proposes a novel adversarial mixup (AM) training method which simply executes OOD data augmentation to synthesize differently distributed data and designs a new AM loss function to learn how to handle OOD data. The proposed AM generates OOD samples being significantly diverged from the support of training data distribution but not completely disjoint to increase the generalization capability of the OOD detector. In addition, the AM is combined with a distributional-distance-aware OOD detector at inference to detect semantic OOD samples more efficiently while being robust to covariate shift due to data tampering. Experimental evaluation validates that the designed AM is effective on both OOD detection and OOD generalization tasks compared to previous OOD detectors and data mixup methods."
"Studying Large Language Model Behaviors Under Realistic Knowledge Conflicts.","2024","CoRR","Evgenii Kortukov, Alexander Rubinstein 0002, Elisa Nguyen, Seong Joon Oh","Informal and Other Publications","https://dblp.org/rec/journals/corr/abs-2404-16032","Retrieval-augmented generation (RAG) mitigates many problems of fully parametric language models, such as temporal degradation, hallucinations, and lack of grounding. In RAG, the model’s knowledge can be updated from documents provided in context. This leads to cases of conflict between the model’s parametric knowledge and the contextual information, where the model may not always update its knowledge. Previous work studied knowledge conflicts by creating synthetic documents that contradict the model’s correct parametric answers. We present a framework for studying knowledge conflicts in a realistic setup. We update incorrect parametric knowledge using real conflicting documents. This reflects how knowledge conflicts arise in practice. In this realistic scenario, we find that knowledge updates fail less often than previously reported. In cases where the models still fail to update their answers, we find a parametric bias: the incorrect parametric answer appearing in context makes the knowledge update likelier to fail. These results suggest that the factual parametric knowledge of LLMs can negatively influence their reading abilities and behaviors. Our code is available at: https://github.com/kortukov/realistic_knowledge_conflicts/ ."
"Towards User-Focused Research in Training Data Attribution for Human-Centered Explainable AI.","2024","CoRR","Elisa Nguyen, Johannes Bertram, Evgenii Kortukov, Jean Y. Song, Seong Joon Oh","Informal and Other Publications","https://dblp.org/rec/journals/corr/abs-2409-16978","While Explainable AI (XAI) aims to make AI understandable and useful to humans, it has been criticised for relying too much on formalism and solutionism, focusing more on mathematical soundness than user needs. We propose an alternative to this bottom-up approach inspired by design thinking: the XAI research community should adopt a top-down, user-focused perspective to ensure user relevance. We illustrate this with a relatively young subfield of XAI, Training Data Attribution (TDA). With the surge in TDA research and growing competition, the field risks repeating the same patterns of solutionism. We conducted a needfinding study with a diverse group of AI practitioners to identify potential user needs related to TDA. Through interviews (N=10) and a systematic survey (N=31), we uncovered new TDA tasks that are currently largely overlooked. We invite the TDA and XAI communities to consider these novel tasks and improve the user relevance of their research outcomes."
"A 1ynm 1.25V 8Gb 16Gb/s/Pin GDDR6-Based Accelerator-in-Memory Supporting 1TFLOPS MAC Operation and Various Activation Functions for Deep Learning Application.","2023","IEEE J. Solid State Circuits","Dae-Han Kwon, Seongju Lee, Kyuyoung Kim, Sanghoon Oh, Joonhong Park, Gimoon Hong, Dongyoon Ka, Kyu-Dong Hwang, Jeongje Park, Kyeong Pil Kang, Jungyeon Kim, Junyeol Jeon, Nahsung Kim, Yongkee Kwon, Kornijcuk Vladimir, Woojae Shin, Jongsoon Won, Minkyu Lee, Hyunha Joo, Haerang Choi, Guhyun Kim, Byeongju An, Jaewook Lee, Donguc Ko, Younggun Jun, Ilwoong Kim, Choungki Song, Ilkon Kim, Chanwook Park, Seho Kim, Chunseok Jeong, Euicheol Lim, Dongkyun Kim, Jieun Jang, Il Park 0001, Junhyun Chun, Joohwan Cho","Journal Articles","https://dblp.org/rec/journals/jssc/KwonLKOPHKHPKKJ23","In this article, a 1.25-V 8-Gb, 16-Gb/s/pin GDDR6-based accelerator-in-memory (AiM) is presented. A dedicated command (CMD) set for deep learning (DL) is introduced to minimize latency when switching operation modes, and a bank-wide mantissa shift (BWMS) scheme is adopted to minimize calculation delay time, current consumption, and circuit area during multiply-accumulate (MAC) operation. By storing the lookup table (LUT) in the reserved word line in the dynamic random access memory (DRAM) bank cell, it is possible to support various activation functions (AFs), such as Gaussian error linear unit (GELU), sigmoid, and Tanh as well as rectified linear unit (ReLU) and Leaky ReLU. Performance evaluation was conducted by measuring the fabricated chip in ATE and a self-manufactured field-programmable gate array (FPGA)-based system. In the ATE-level evaluation, it operates at 16 Gbps up to a voltage as low as 1.10 V. When evaluated by GEMV and MNIST in the FPGA-based system, it was confirmed that the performance gains of 7.5–10.5 times were possible compared to the HBM2-based or GDDR6-based systems."
"All-Flash Array Key-Value Cache for Large Objects.","2023","EuroSys","Jinhyung Koo, Jinwook Bae, Minjeong Yuk, Seonggyun Oh, Jungwoo Kim, Jung-Soo Park, Eunji Lee, Bryan S. Kim, Sungjin Lee 0001","Conference and Workshop Papers","https://dblp.org/rec/conf/eurosys/KooBYOKPLKL23","We present BigKV, a key-value cache specifically designed for caching large objects in an all-flash array (AFA). The design of BigKV is centered around the unique property of a cache: since it contains a copy of the data, exact bookkeeping of what is in the cache is not critical for correctness. By ignoring hash collisions, approximating metadata information, and allowing data loss from failures, BigKV significantly increases the cache hit ratio and keeps more useful objects in the system. Experiments on a real AFA show that our design increases the throughput by 3.1× on average and reduces the average and tail latency by 57% and 81%, respectively."
"Evaluation for Weakly Supervised Object Localization: Protocol, Metrics, and Datasets.","2023","IEEE Trans. Pattern Anal. Mach. Intell.","Junsuk Choe, Seong Joon Oh, Sanghyuk Chun, Seungho Lee, Zeynep Akata, Hyunjung Shim","Journal Articles","https://dblp.org/rec/journals/pami/ChoeOCLAS23","Weakly-supervised object localization (WSOL) has gained popularity over the last years for its promise to train localization models with only image-level labels. Since the seminal WSOL work of class activation mapping (CAM), the field has focused on how to expand the attention regions to cover objects more broadly and localize them better. However, these strategies rely on full localization supervision for validating hyperparameters and model selection, which is in principle prohibited under the WSOL setup. In this paper, we argue that WSOL task is ill-posed with only image-level labels, and propose a new evaluation protocol where full supervision is limited to only a small held-out set not overlapping with the test set. We observe that, under our protocol, the five most recent WSOL methods have not made a major improvement over the CAM baseline. Moreover, we report that existing WSOL methods have not reached the few-shot learning baseline, where the full-supervision at validation time is used for model training instead. Based on our findings, we discuss some future directions for WSOL. Source code and dataset are available at https://github.com/clovaai/wsolevaluation https://github.com/clovaai/wsolevaluation."
"Exploring Practitioner Perspectives On Training Data Attribution Explanations.","2023","CoRR","Elisa Nguyen, Evgenii Kortukov, Jean Y. Song, Seong Joon Oh","Informal and Other Publications","https://dblp.org/rec/journals/corr/abs-2310-20477","Explainable AI (XAI) aims to provide insight into opaque model reasoning to humans and as such is an interdisciplinary field by nature. In this paper, we interviewed 10 practitioners to understand the possible usability of training data attribution (TDA) explanations and to explore the design space of such an approach. We confirmed that training data quality is often the most important factor for high model performance in practice and model developers mainly rely on their own experience to curate data. End-users expect explanations to enhance their interaction with the model and do not necessarily prioritise but are open to training data as a means of explanation. Within our participants, we found that TDA explanations are not well-known and therefore not used. We urge the community to focus on the utility of TDA techniques from the human-machine collaboration perspective and broaden the TDA evaluation to reflect common use cases in practice."
"ID and OOD Performance Are Sometimes Inversely Correlated on Real-world Datasets.","2023","NeurIPS","Damien Teney, Yong Lin, Seong Joon Oh, Ehsan Abbasnejad","Conference and Workshop Papers","https://dblp.org/rec/conf/nips/TeneyLOA23",""
"Investigation of Sub-20nm 4th generation DRAM cell transistor's parasitic resistance and scalable methodology for Sub-20nm era.","2023","IRPS","Shinwoo Jeong, Jin-Seong Lee, Jiuk Jang, Jooncheol Kim, Hyunsu Shin, Jihun Kim, Jeongwoo Song, Dongsoo Woo, Jeonghoon Oh, Jooyoung Lee","Conference and Workshop Papers","https://dblp.org/rec/conf/irps/JeongLJKSKSWOL23","The component of cell parasitic resistance at sub-20nm 4th generation DRAM cell transistor is investigated. To evaluate the cell characteristics, the Gate Buried Contact (GBC) to Active contact formation method with varied dopant concentrations was studied. We have discovered a scalable methodology that simultaneously reduces parasitic resistance and leakage with regard to Gate Induced Drain Leakage (GIDL). Also, we proved the importance of interface quality of Direct Contact on Cell (DCC) in order to reduce the parasitic resistance. The failure analysis is conducted by segmenting the resistance with Test Element Groups (TEGs) at wafer level. And the process windows and local variations from fabricated devices are electrically verified by core failure analysis. Through this investigation, we proposed the scalable methodology that can sustain generational scalability of DRAM."
"Playing repeated games with Large Language Models.","2023","CoRR","Elif Akata, Lion Schulz, Julian Coda-Forno, Seong Joon Oh, Matthias Bethge, Eric Schulz","Informal and Other Publications","https://dblp.org/rec/journals/corr/abs-2305-16867","Large Language Models (LLMs) are transforming society and permeating into diverse applications. As a result, LLMs will frequently interact with us and other agents. It is, therefore, of great societal value to understand how LLMs behave in interactive social settings. Here, we propose to use behavioral game theory to study LLM's cooperation and coordination behavior. To do so, we let different LLMs (GPT-3, GPT-3.5, and GPT-4) play finitely repeated games with each other and with other, human-like strategies. Our results show that LLMs generally perform well in such tasks and also uncover persistent behavioral signatures. In a large set of two players-two strategies games, we find that LLMs are particularly good at games where valuing their own self-interest pays off, like the iterated Prisoner's Dilemma family. However, they behave sub-optimally in games that require coordination. We, therefore, further focus on two games from these distinct families. In the canonical iterated Prisoner's Dilemma, we find that GPT-4 acts particularly unforgivingly, always defecting after another agent has defected only once. In the Battle of the Sexes, we find that GPT-4 cannot match the behavior of the simple convention to alternate between options. We verify that these behavioral signatures are stable across robustness checks. Finally, we show how GPT-4's behavior can be modified by providing further information about the other player as well as by asking it to predict the other player's actions before making a choice. These results enrich our understanding of LLM's social behavior and pave the way for a behavioral game theory for machines."
"ProPILE: Probing Privacy Leakage in Large Language Models.","2023","NeurIPS","Siwon Kim, Sangdoo Yun, Hwaran Lee, Martin Gubri, Sungroh Yoon, Seong Joon Oh","Conference and Workshop Papers","https://dblp.org/rec/conf/nips/KimYLGYO23","The rapid advancement and widespread use of large language models (LLMs) have raised significant concerns regarding the potential leakage of personally identifiable information (PII). These models are often trained on vast quantities of web-collected data, which may inadvertently include sensitive personal data. This paper presents ProPILE, a novel probing tool designed to empower data subjects, or the owners of the PII, with awareness of potential PII leakage in LLM-based services. ProPILE lets data subjects formulate prompts based on their own PII to evaluate the level of privacy intrusion in LLMs. We demonstrate its application on the OPT-1.3B model trained on the publicly available Pile dataset. We show how hypothetical data subjects may assess the likelihood of their PII being included in the Pile dataset being revealed. ProPILE can also be leveraged by LLM service providers to effectively evaluate their own levels of PII leakage with more powerful prompts specifically tuned for their in-house models. This tool represents a pioneering step towards empowering the data subjects for their awareness and control over their own data on the web."
"Probabilistic Contrastive Learning Recovers the Correct Aleatoric Uncertainty of Ambiguous Inputs.","2023","ICML","Michael Kirchhof, Enkelejda Kasneci, Seong Joon Oh","Conference and Workshop Papers","https://dblp.org/rec/conf/icml/KirchhofKO23","Contrastively trained encoders have recently been proven to invert the data-generating process: they encode each input, e.g., an image, into the true latent vector that generated the image (Zimmermann et al., 2021). However, real-world observations often have inherent ambiguities. For instance, images may be blurred or only show a 2D view of a 3D object, so multiple latents could have generated them. This makes the true posterior for the latent vector probabilistic with heteroscedastic uncertainty. In this setup, we extend the common InfoNCE objective and encoders to predict latent distributions instead of points. We prove that these distributions recover the correct posteriors of the data-generating process, including its level of aleatoric uncertainty, up to a rotation of the latent space. In addition to providing calibrated uncertainty estimates, these posteriors allow the computation of credible intervals in image retrieval. They comprise images with the same latent as a given query, subject to its uncertainty. Code is available at https://github.com/mkirchhof/Probabilistic_Contrastive_Learning"
"Shortcut Bias Mitigation via Ensemble Diversity Using Diffusion Probabilistic Models.","2023","CoRR","Luca Scimeca, Alexander Rubinstein 0002, Damien Teney, Seong Joon Oh, Armand Mihai Nicolicioiu, Yoshua Bengio","Informal and Other Publications","https://dblp.org/rec/journals/corr/abs-2311-16176","Spurious correlations in the data, where multiple cues are predictive of the target labels, often lead to a phenomenon known as shortcut learning, where a model relies on erroneous, easy-to-learn cues while ignoring reliable ones. In this work, we propose DiffDiv an ensemble diversification framework exploiting Diffusion Probabilistic Models (DPMs) to mitigate this form of bias. We show that at particular training intervals, DPMs can generate images with novel feature combinations, even when trained on samples displaying correlated input features. We leverage this crucial property to generate synthetic counterfactuals to increase model diversity via ensemble disagreement. We show that DPM-guided diversification is sufficient to remove dependence on shortcut cues, without a need for additional supervised signals. We further empirically quantify its efficacy on several diversification objectives, and finally show improved generalization and diversification on par with prior work that relies on auxiliary data collection."
"The StarCraft Multi-Agent Exploration Challenges: Learning Multi-Stage Tasks and Environmental Factors Without Precise Reward Functions.","2023","IEEE Access","Mingyu Kim 0002, Jihwan Oh, Yongsik Lee, Joonkee Kim, Seonghwan Kim 0004, Song Chong, Seyoung Yun","Journal Articles","https://dblp.org/rec/journals/access/KimOLKKCY23","In this paper, we propose a novel benchmark called the StarCraft Multi-Agent Exploration Challenges(SMAC-Exp), where agents learn to perform multi-stage tasks and to use environmental factors without precise reward functions. The previous challenges (SMAC) recognized as a standard benchmark of Multi-Agent Reinforcement Learning are mainly concerned with ensuring that all agents cooperatively eliminate approaching adversaries only through fine manipulation with obvious reward functions. SMAC-Exp, on the other hand, is interested in the exploration capability of MARL algorithms to efficiently learn implicit multi-stage tasks and environmental factors as well as micro-control. This study covers both offensive and defensive scenarios. In the offensive scenarios, agents must learn to first find opponents and then eliminate them. The defensive scenarios require agents to use topographic features. For example, agents need to position themselves behind protective structures to make it harder for enemies to attack. We investigate a total of twelve MARL algorithms under both sequential and parallel episode settings of SMAC-Exp and observe that recent approaches perform well in similar settings to the previous challenge, but we discover that current multi-agent approaches place relatively less emphasis on exploration perspectives. To a limited extent, we observe that an enhanced exploration method has a positive effect on SMAC-Exp, however, there is still a gap that state-of-the-art algorithms cannot resolve the most challenging scenarios of SMAC-Exp. Consequently, we propose a new axis for future research into Multi-Agent Reinforcement Learning studies."
"Trustworthy Machine Learning.","2023","CoRR","Bálint Mucsányi, Michael Kirchhof, Elisa Nguyen, Alexander Rubinstein 0002, Seong Joon Oh","Informal and Other Publications","https://dblp.org/rec/journals/corr/abs-2310-08215","AbstractWe introduce a flexible program synthesis system whose task is to predict function compositions that transform given inputs to their corresponding given outputs. We process input lists in a sequential manner, allowing the system to generalize to a wide range of input lengths. We separate the operator and the operand in the lambda functions of the used higher order functions to achieve significantly wider numeric parameter ranges compared to the previous works. The evaluations show that this approach is competitive with state-of-the-art systems, while it is much more flexible in terms of the input length, the parameters of the lambda functions, and the integer range of the inputs and outputs. We extend the system to handle tree-structured function compositions by introducing two additional functions (, copy) and the ability to represent unfinished function compositions during the synthesis process. The extended system achieves state-of-the-art results while synthesizing complex function compositions with multiple forks. We believe that flexibility in these aspects is an important step towards solving real-world problems with example-based program synthesis."
