"title","year","venue","authors","type","url","abstract"
"Line Graphics Digitization: A Step Towards Full Automation.","2023","ICDAR","Omar Moured, Jiaming Zhang 0001, Alina Roitberg, Thorsten Schwarz, Rainer Stiefelhagen","Conference and Workshop Papers","https://dblp.org/rec/conf/icdar/MouredZRSS23","The digitization of documents allows for wider accessibility and reproducibility. While automatic digitization of document layout and text content has been a long-standing focus of research, this problem in regard to graphical elements, such as statistical plots, has been under-explored. In this paper, we introduce the task of fine-grained visual understanding of mathematical graphics and present the Line Graphics (LG) dataset, which includes pixel-wise annotations of 5 coarse and 10 fine-grained categories. Our dataset covers 520 images of mathematical graphics collected from 450 documents from different disciplines. Our proposed dataset can support two different computer vision tasks, i.e., semantic segmentation and object detection. To benchmark our LG dataset, we explore 7 state-of-the-art models. To foster further research on the digitization of statistical graphs, we will make the dataset, code, and models publicly available to the community."
"MuscleMap: Towards Video-based Activated Muscle Group Estimation.","2023","CoRR","Kunyu Peng, David Schneider, Alina Roitberg, Kailun Yang 0001, Jiaming Zhang 0001, M. Saquib Sarfraz, Rainer Stiefelhagen","Informal and Other Publications","https://dblp.org/rec/journals/corr/abs-2303-00952",""
"On Transferability of Driver Observation Models from Simulated to Real Environments in Autonomous Cars.","2023","ITSC","Walter Morales-Alvarez, Novel Certad, Alina Roitberg, Rainer Stiefelhagen, Cristina Olaverri-Monreal","Conference and Workshop Papers","https://dblp.org/rec/conf/itsc/Morales-Alvarez23",""
"Quantized Distillation: Optimizing Driver Activity Recognition Models for Resource-Constrained Environments.","2023","IROS","Calvin Tanama, Kunyu Peng, Zdravko Marinov, Rainer Stiefelhagen, Alina Roitberg","Conference and Workshop Papers","https://dblp.org/rec/conf/iros/TanamaPMSR23","Deep learning-based models are at the top of most driver observation benchmarks due to their remarkable accuracies but come with a high computational cost, while the resources are often limited in real-world driving scenarios. This paper presents a lightweight framework for resource- efficient driver activity recognition. We enhance 3D MobileNet, a speed-optimized neural architecture for video classification, with two paradigms for improving the trade-off between model accuracy and computational efficiency: knowledge distillation and model quantization. Knowledge distillation prevents large drops in accuracy when reducing the model size by harvesting knowledge from a large teacher model (I3D) via soft labels instead of using the original ground truth. Quantization further drastically reduces the memory and computation requirements by representing the model weights and activations using lower precision integers. Extensive experiments on a public dataset for in-vehicle monitoring during autonomous driving show that our proposed framework leads to an 3- fold reduction in model size and 1.4-fold improvement in inference time compared to an already speed-optimized architecture. Our code is available at https://github.com/calvintanama/qd-driver-activity-reco."
"Towards Privacy-Supporting Fall Detection via Deep Unsupervised RGB2Depth Adaptation.","2023","CoRR","Hejun Xiao, Kunyu Peng, Xiangsheng Huang, Alina Roitberg, Hao Li, Zhaohui Wang, Rainer Stiefelhagen","Informal and Other Publications","https://dblp.org/rec/journals/corr/abs-2308-12049","Fall detection is a vital task in health monitoring, as it allows the system to trigger an alert and therefore enable faster interventions when a person experiences a fall. Although most previous approaches rely on standard RGB video data, such detailed appearance-aware monitoring poses significant privacy concerns. Depth sensors, on the other hand, are better at preserving privacy as they merely capture the distance of objects from the sensor or camera, omitting color and texture information. In this article, we introduce a privacy-supporting solution that makes the RGB-trained model applicable in the depth domain and utilizes depth data at test time for fall detection. To achieve cross-modal fall detection, we present an unsupervised RGB domain to the depth domain (RGB2Depth) cross-modal domain adaptation approach that leverages labeled RGB data and unlabeled depth data during training. Our proposed pipeline incorporates an intermediate domain module (IDM) for feature bridging, modality adversarial loss for modality discrimination, classification loss for pseudo-labeled depth data and labeled source data, triplet loss that considers both the source and target domains, and a novel adaptive loss weight adjustment method for improved coordination among various losses. Our approach achieves state-of-the-art results in the unsupervised RGB2Depth domain adaptation task for fall detection. Code is available at https://github.com/1015206533/privacy_supporting_fall_detection."
"Navigating Open Set Scenarios for Skeleton-based Action Recognition.","2023","CoRR","Kunyu Peng, Cheng Yin, Junwei Zheng, Ruiping Liu, David Schneider, Jiaming Zhang 0001, Kailun Yang 0001, M. Saquib Sarfraz, Rainer Stiefelhagen, Alina Roitberg","Informal and Other Publications","https://dblp.org/rec/journals/corr/abs-2312-06330","In real-world scenarios, human actions often fall outside the distribution of training data, making it crucial for models to recognize known actions and reject unknown ones. However, using pure skeleton data in such open-set conditions poses challenges due to the lack of visual background cues and the distinct sparse structure of body pose sequences. In this paper, we tackle the unexplored Open-Set Skeleton-based Action Recognition (OS-SAR) task and formalize the benchmark on three skeleton-based datasets. We assess the performance of seven established open-set approaches on our task and identify their limits and critical generalization issues when dealing with skeleton information.To address these challenges, we propose a distance-based cross-modality ensemble method that leverages the cross-modal alignment of skeleton joints, bones, and velocities to achieve superior open-set recognition performance. We refer to the key idea as CrossMax - an approach that utilizes a novel cross-modality mean max discrepancy suppression mechanism to align latent spaces during training and a cross-modality distance-based logits refinement method during testing. CrossMax outperforms existing approaches and consistently yields state-of-the-art results across all datasets and backbones. We will release the benchmark, code, and models to the community."
"Unveiling the Hidden Realm: Self-supervised Skeleton-based Action Recognition in Occluded Environments.","2023","CoRR","Yifei Chen, Kunyu Peng, Alina Roitberg, David Schneider, Jiaming Zhang 0001, Junwei Zheng, Ruiping Liu, Yufan Chen, Kailun Yang 0001, Rainer Stiefelhagen","Informal and Other Publications","https://dblp.org/rec/journals/corr/abs-2309-12029",""
